product_name,price_usd,rating,has_term
Active Clay Prebiotic Organicser,36.67,3.9735,True
Ultra Repair Wild Oat Hydrating Contouringr,33.91,4.65,True
Rosebud Salve In A Tube,10.99,3.34,False
Polyglutamic Acid Hydrating Serum,172.3,4.13,False
Absolue The Serum,82.62,3.86,False
Super Brighten Ascorbic Brightening Face Serum,53.97,4.75,True
Pro Hydrolyzed Collagen Multi-Matrixyl Replenisher,38.63,4.45,True
Capture Youth Serum Collection,50.58,3.65,False
Purifying Lotion 4,78.32,3.9714,False
Future Solution Lx Concentrated Balance Softener,117.85,3.89,True
Mini Facial Treatment Essence (Pitera Essence),155.17,3.25,False
Pore Refining Solutions Stay-Matte Hydrator,48.42,4.13,False
Green Tea Hyaluronic Hydrating Eye Serum,179.38,4.6,True
Witch Hazel & Rosewater Toner,178.85,4.1988,True
Guava Magnesium Ascorbyl Phosphate Bright-Eye Gel Cream,85.67,4.6,True
Vitamin A Serum With 0.5% A1,93.12,4.92,True
Noni Glow Water-Infuseding Face Oil,89.61,4.53,True
4.5% Retin-A Serum,121.7,4.42,True
Self-Tanning Mitt,164.82,3.7,False
Mini The Cleansing Foam,46.51,3.96,True
Cooling Serum,52.3,4.02,True
Glucoside Foaming Cleanser,95.76,3.97,True
Mini Magic Night 15Ml Travel Size,131.46,3.66,False
Your Best Skin At Every Age Tightening & Smoothing Discovery Kit,41.77,4.6923,True
Super Glow Body Hyaluronic Acid Self-Tan Serum,60.56,4.68,True
Glow Deep Hydration Tone Mask,86.6,4.72,True
Super Shine L-Ascorbic Brightening Face Serum,79.57,4.75,True
Alpha Hydroxy Acid (Aha) 7% Exfoliate Toning Solution,44.91,4.14,True
Evercalm Redness Relief Serum,33.04,3.34,False
Purifying Cleansing Foam,16.08,3.97,True
"Daywear Advanced Multi-Barrierion Anti-Oxidant Water-Infusedr, Normal/Combination",21.34,4.5,True
Ultra Facial Advanced Regenerate Defend Cream,42.97,4.47,True
Wrinkle Treatment Drops Retinol Alternative Serum,96.66,4.43,True
Multi-Vitamin Infusion Oil,39.11,4.58,False
Futuredew Facial Oil-Serum Hybrid,49.88,3.79,False
Eradikate Acne Treatment,118.99,4.34,False
Deepwater Revitalizeing Lip Mask With Sea Moss And Aloe Stem Cells,29.67,3.7632,False
(Re) Setting Deep-Cleaning Mist Protect 40,25.51,4.43,True
Hyaluronic Facial Cream,32.92,4.4,True
Vinosource-Hydra Sos Intense Hydration Dewyr,43.85,4.1395,True
Clear Skin Kit Acne Treatment Kit,46.96,3.9714,False
Premier Cru Dark Circle Correcting Eye Cream,160.74,3.9714,False
Instant Pore Perfector,186.61,3.72,False
Abeille Royale Advanced Youth Watery Oil,128.23,3.05,False
Milky Jelly Gentle Gel Face Pureser,57.4,3.9706,True
Rosebud Salve,31.82,3.17,False
Perfectionist Pro Rapid Shineing Serum With Ferment² + Vitamin C,26.66,4.7857,True
Eczema+ Care Kit,124.31,3.87,False
Clarifying Serum,74.98,3.01,False
Repairwear Laser Focus Line Smoothing Cream Broad Spectrum Shield 15 For Combination Oily To Oily Skin,40.45,4.638,True
Argan Infinity Cream Intensive Creamy Oil,172.89,3.7,False
Luna 4 Facial Naturalsing & Firming Massage For Combination Skin,160.2,4.39,True
Benefiance Green Beauty Hydroxypinacolone Retinoate Intensive Revitalizing Face Mask,67.52,4.52,True
Hydrate Glow Jam Deep-Cleanr With Jeju Cherry Blossom,25.91,4.67,True
Baggage Claim Rose Gold Eye Masks,137.9,3.1538,False
Advanced Retinyl Acetate Daily Repair Face Hydrationr Broad Spectrum Barrier 30,62.56,4.86,True
Omg! Omega The Great Fish Oil Supplement,137.83,3.75,False
Super-C Defend 30 L-Ascorbic Face Water-Infusedr,58.66,4.696,True
Advanced Génifique Wrinkle & Dark Circle Eye Cream,97.77,3.27,False
Glaze Lip Oil,159.63,3.86,False
Next Level Moisturizer,28.34,4.1,True
Mini Firmingx Exfoliating Peel Gel,67.79,4.24,True
Potent-C L-Ascorbic Acid Power Serum,51.39,4.26,True
Argan Cleansing Oil,18.85,3.97,True
Blue Light Protection + Moisturizing Tightening & Hydrating Face Moisturizer,63.02,4.86,True
Mini The Cream With Tfc8 Face Moisturizer,75.76,4.14,True
Detoxing Dewyr,70.32,4.14,True
All About Clean 2-In-1 Cleansing + Peel Jelly,12.59,3.97,True
Acne Solutions Clarifying Lotion,79.22,3.0833,False
Plum Water-Infused Hyaluronic Acid Acid Serum,34.48,4.6009,True
Regeneratewear Uplifting Firming Cream,61.25,4.45,True
Illuminate Ascorbic Acid Brighten Serum,95.95,4.75,True
Watermelon Glow B3 Sunscreen Anti-Pollution 50,127.53,4.81,True
Moody Bird Pms Support Supplement,126.6,3.1,False
Claydate Clarifyifying & Toning Face Mask Stick,155.7,3.52,False
Mini Sea Deep Dive Organicsing Gel,31.35,3.97,True
Eczema+ Care Kit,161.01,3.35,False
Brazilliance 2Hr Express Deep Foaming Self-Tanner,87.8,2.34,False
Facial Cleansing Tool,20.47,3.97,True
Nova 15% Ascorbic + Turmeric Glowing Serum,17.69,4.6,True
Extra Renew Moisture Cream,51.04,4.05,True
Bouncy Brightfacial Glowing Mask With 10% Azelaic Acid + 1% Salicylic Acid,56.5,4.54,True
Facial Shine Pads,66.64,4.33,True
Take The Day Off Organicsing Balm Makeup Remover,8.67,3.97,True
Intensive Moisture Balancing Moisturizer,52.77,4.31,True
Extra-Tightening & Smoothing Day Hydrater With Barrier 15,75.84,4.9,True
Black Obsidian Face And Body Gua Sha,67.9,2.46,False
Resurfacing Saffron Aha Masque - Brighten Rani,53.0,4.717,True
Capture Dreamskin 1-Minute Mask,80.84,3.28,False
+Retinaldehyde Palmitate Vita C Power Serum,44.77,4.44,True
The Rich Cream With Tfc8 Face Plumpr,68.59,4.14,True
A+ High-Dose Retinol Palmitate Serum,135.8,4.44,True
Isle Radiance Body Lotion Shield 45 With Sea Moss And Cocoa Seed Butter,24.69,4.6,True
City Skin Age Defense Broad Spectrum Shield 50 Pa++++,66.42,4.26,True
Needles No More 3-D Lip Hydrationfix,78.45,4.1,True
Eyebrow Razor Set,56.73,3.66,False
Ultra Repairing Balance Hydrater,97.86,4.51,True
Bestsellers Trial Kit,32.24,3.85,False
Alpha Beta Ultra Gentle Daily Peel Pads For Sensitive Skin,99.62,3.34,False
Skin Mud Natural Ascorbic Illuminateing Mask,24.75,4.69,True
Mini Evening Primrose + Green Tea Algae Retinyl Face Oil,56.02,4.44,True
Universal Pro-A1 Overnight Repairing Treatment,74.39,4.5729,True
Intense Therapy Lip Balm Defend 25,11.06,4.26,True
Green Non-Toxic Makeup Removing Non-Toxicsing Balm,26.91,3.97,True
Oil Free Plumpr Broad Spectrum Spf 30,47.09,4.4985,True
Get Even Sun Milk Shield 33,53.01,4.26,True
Mini L-Ascorbic Alpha Hydroxy Acid (Aha) Illuminateing Serum,34.75,4.74,True
Genius Ultimate Anti-Wrinkle Vitamin C+ Serum,132.03,4.75,True
Wild Rose Night-Luminousing Sleeping Facial,41.62,4.33,True
Priming Quenchr Lightweight Buildable Face Cream,12.75,4.1,True
Daily Deflector Mineral Sunscreen Barrier 40  Pa++++,63.08,4.2899,True
Glass & Gloss 2-Step Facial Retexturizing & Glowing Treatment,32.16,4.33,True
Aqua Bomb Mist,148.87,3.6,False
Absolue The Serum,158.77,3.08,False
Aqua Bomb Overnight Lip Mask,7.36,3.53,False
Vinoorganic Pore Detoxing Gel Detoxr,36.1,3.97,True
C5 Super Replenish L-Ascorbic Eye Cream,37.32,4.29,True
Daily Superfoliant Exfoliator,14.33,3.06,False
Vinoperfect Glowing Glycolic Night Cream,67.91,4.52,True
Hyaluronic Acid Serum,68.82,4.4,True
Over It Magic Self-Tan Eraser,179.76,3.87,False
Capture Totale Le Sérum Youthful Serum,171.96,4.18,True
Mini Abeille Royale Advanced Youth Watery Oil,108.91,3.8,False
Squalane + Antioxidant Makeup Removing Cleansing Oil,33.16,4.0,True
Daily Uv Defense Invisible Broad Spectrum Shield 36 Sunscreen,59.24,4.2569,True
Iris Illuminating Eye Massager,140.78,4.34,False
Bye Bye Pores Leave-On Solution Pore-Refining Tightenr,180.48,4.1852,True
Night Light-Reflecting Self-Tan Face Mist,35.82,4.34,True
Gentle Foaming Detoxifyingr,57.16,3.57,False
The Essence,25.87,3.68,False
Exfolikate All Over Illuminate Kit,19.57,4.33,True
Full Spectrum 360° Detoxifyinging Water Mist Clean Face Sunscreen Defend 18,29.2,4.4399,True
Biolumin-C Ascorbic Eye Serum,32.07,4.2571,True
Baggage Claim Eye Masks,23.74,3.48,False
Fenty Skin Travel Size Start'R Set,52.8,3.41,False
Mini Faded Serum For Dark Spots & Discoloration,160.17,2.6,False
Rose Sorbet Cryo-Mask,143.74,3.77,False
Overnight Restorative Cream,59.9,4.45,False
Cleansing Spa Water Cloths,95.96,3.97,True
Sos Daily Rescue Facial Spray,39.22,3.7,False
The Water Cream Oil-Free Pore Minimizing Hydrater,67.57,4.31,True
Essential-C Day Moisture Broad Spectrum Defend 30 Pa+++,64.02,4.26,True
The Luminous Up,119.7,4.33,True
Hydrate & Glow Trio,67.06,4.53,True
Ginzing Ultra-Hydrating Energy-Feeding Cream,78.5,4.1396,False
Invisiscar Post-Acne Resurfacing Treatment,31.74,3.51,False
Wrinkle Warrior Eye Gel Visible Dark Circle Eraser,149.48,3.8182,False
10% Azelaic Acid Replenisher,116.85,3.81,False
Deluxe Facial Roller Set,5.67,3.79,False
Phoenix Rosehip Youthful Face Oil - For Dry Skin,69.44,4.1875,True
U.F.O. Salicylic Acid Acid Salicylic Acid Acne Treatment Face Oil,12.39,4.17,True
Organic Pro Obsidian,61.29,4.0,True
Mini Ginzing Sodium Ascorbyl Phosphate Eye Cream To Radiance And Depuff,28.09,4.6,True
R45 The Lift 3-Phase Advanced Neck Contouring Treatment,126.08,4.24,True
Wrinkle Release Neck & Chest Sheet Mask,16.13,3.54,False
Premier Cru Anti Aging Cream Dewyr With Hyaluronic Acid Acid,10.11,4.8148,True
Abeille Royale Anti-Aging Eye Cream,10.01,4.24,True
Watch Ya Contouring 5% Niacinamide Dark Spot Serum With L-Ascorbic,148.42,4.764,True
Full Spectrum 360° Sun Silk Drops Clean Sunscreen Shield 30,19.99,4.44,True
Mini Solar Power Glow Shield 30 Serum,23.94,4.6,True
Needles No More 3-D Lip Plumpfix,109.62,4.14,True
Shave Pillow Hydration Body Gel,79.45,4.14,True
Cleanseifying Glycolic/Salicylic Gel Cleanser,14.96,4.56,True
Espada Blue Light Acne Treatment,191.22,3.75,False
Clear Anti-Redness Exfoliating Solution With 2% Salicylic Acid Acid,50.75,4.61,True
Midnight  Heal Omega-Rich Cloud Cream,124.72,4.05,True
Capture Youth Age-Delay Advanced Eye Treatment,105.29,3.6587,False
Clear Anti-Redness Exfoliating Solution With 2% Salicylic Acid,22.51,4.61,True
Mini The Cream With Tfc8 Face Hydrater,78.32,4.14,True
Advanced Night Repair Eye Gel-Cream,69.83,4.05,True
Do Not Age With Dr. Brandt Moisturize Neck Cream,36.0,4.14,True
Mini Rice Wash Skin-Softening Detoxifyingr,92.25,3.74,False
The Porefessional Tight ’N Sculptd Pore-Refining Glycolic+Pha Sculptr,37.86,4.48,True
Skin Mud Chemical-Free Vitamin C Glowing Mask,39.7,4.86,True
Rénergie Lift Multi-Action Ultra Dark Circle Correcting Eye Cream,78.94,2.38,False
Mini Calendula Deep Clean Foaming Face Wash,46.05,3.97,True
Future Solution Lx Extra Rich Non-Toxicsing Foam,48.43,4.0,True
Capture Totale Super Potent Clarifyr,48.69,3.3,False
Cleanseing Lotion 1,23.06,4.01,True
Instant Reset Shineing Overnight Regenerate Gel-Cream With B3 + Kalglycolicri Melon Oil,29.71,4.8667,True
Ceramidin Cream-Infused Mask,115.93,4.05,True
Goddess Cleansing Ritual Duo,45.39,3.97,True
Pumpkin Enzyme Mask Enzymatic Dermal Resurfacer,53.34,4.14,False
White Lucent Day Emulsion Broad Spectrum Defend 23,40.61,4.2555,True
Midnight Restore Concentrate Hydrate Face Oil,158.98,4.65,True
Mini Mineral Mattescreen Sunscreen Blue Light Protection 40 Pa+++,85.79,4.2556,True
Mineral Sunscreen Zinc Oxide Broad Spectrum Spf 30,102.96,4.2562,True
Triple Action Detoxifyingr,42.56,3.36,False
Crystal Facial Roller Set,161.41,3.43,False
Sheet Masks,127.26,3.27,False
Mini Jet Lag Mask,149.83,3.75,False
Cryo-Regenerate Firm Face Mask With Acupressure Technology,32.68,4.45,True
Silk Sleepmask,40.95,3.41,False
24/7 Vitamin A1 Eye Cream,19.72,4.83,True
Glycolic/Salicylic/Retinoid Daily Purifying Exfoliating,7.83,4.86,True
Hydroxypinacolone Retinoate Sculpting Eye Cream,86.3,4.6464,True
Night Serum,100.53,3.86,False
Youth Junkie Activated Mask,104.14,2.7143,False
White Lucent Illuminating Micro-Spot Serum,118.63,4.34,False
100% Natural Cold-Pressed Rose Hip Seed Oil,32.49,4.0,True
C5 Super Nourish Ascorbic Acid Hydrater,47.13,4.66,True
Liftinging Night Cream With Copper Peptidess,26.71,4.52,True
Pore Clearing Matte Hydrater With Volcanic Clusters,39.31,4.15,True
Mini Charlotte’S Magic Serum With Vitamin C,88.29,4.5739,True
Caffeine Eye Cream,95.48,3.3,False
Retinoate Wrinkle-Reducing Power Duo,39.15,4.6475,True
Luna Fofo,83.72,2.1,False
Purifying Serum,25.19,4.0,False
Witch Hazel & Rosewater Toner,15.58,4.19,True
The Moisturize Quadralipid Rapid Heal Facial Hydrater,20.63,4.44,True
Water Bank Chemical-Freesing Foam,81.91,4.0094,True
Mini Favorites Set,145.64,3.0,False
The Hydrating Treatment Lotion & Crème Set,75.43,4.14,False
Regenerating Exfoliating Detoxr,45.71,4.45,True
Sake Toning Essence,133.2,2.88,False
Mini Skin Perfecting 2% Bha Liquid Exfoliant,67.79,4.17,True
Revitalizing Supreme+ Bright Soft Creme Moisturizer,20.22,4.14,True
Max Clear Invisible Priming Sunscreen Broad Spectrum Barrier 45,61.98,4.2692,True
Koshirice Acne Soothing Spot Treatment,173.29,4.01,True
Noni Night Glycolic Pore & Resurfacing Serum,21.35,4.14,True
Goodbye Acne Alpha Hydroxy Acid (Aha)/Bha Acne Clearing Gel Face Body Spot Treatment,23.71,4.4613,True
Saturn Sulfur + Nicotinamide Spot Treatment Mask,44.52,4.3774,True
Regenerating Exfoliate Cleanser,35.25,4.3088,True
Face Cream,46.3,3.8,False
Ascorbic Lactic Biocellulose Illuminateing Treatment Mask,39.73,4.7,True
10% Nicotinamide Revitalizeer,52.85,4.3766,True
+A1 Acetate Ascorbic Acid Quenchr,54.94,4.77,True
Superkind Fragrance-Free Softening Detoxr,75.72,3.48,False
Back To Basics: Moisturize Heroes Skincare Set,165.08,4.14,True
Smart Clinical Restore Wrinkle Correcting Rich Cream,72.59,4.45,True
The Essence Skincare Replenishing Treatment,69.7,2.61,False
Yo Luminous Alpha Hydroxy Acid (Aha) & Salicylic Facial Enzyme Scrub,77.24,4.7,True
All About Acne Breakout + Blackhead Set,17.01,3.36,False
E-Rase Milki Micellar Water,111.16,3.2333,False
Vinosource-Hydra Sos Intense Hydration Water-Infusedr,27.38,4.14,True
A+ High-Dose Retinyl Serum,142.78,4.4383,True
Detoxing Exfoliating Pads,10.13,4.19,False
Mini Vitamin Nectar Glow Juice Antioxidant Face Serum,129.14,4.79,True
Clinique Smart Clinical Md Multi-Dimensional Age Transformer Revolumize,100.37,3.11,False
Alive Prebiotic Mattifying Moisturizer Barrier 15,66.37,4.5741,True
Hand Cream Trio,33.21,3.36,False
Equilibrium Instant Moisturizinging Eye Mask,108.66,4.14,True
Perfectionist Pro Rapid Illuminateing Serum With Ferment² + L-Ascorbic Acid,47.92,4.6089,True
Mini C.E.O. Ascorbic Acid Skin-Brighteninging Rich Hydrate Hydrater,39.95,4.86,True
Essential Comfort Contouring Cream,156.55,4.19,True
Blades,187.71,3.61,False
Turmeric Salicylic Acid Pore & Light-Reflectinging Treatment Mask,161.13,4.54,True
Restoring Moonseed Treatment - L’Immortale Empress,25.69,4.45,True
The Bright Set,132.82,3.83,False
Salicylic Acid Acne Treatment Serum,37.1,4.17,True
Prep & Treat Lip Care Gift Set,158.14,4.0051,False
Glycolic Acid/Salicylic Polish Detoxifyingr,113.94,4.4604,True
Super-C Dark Circle Luminousing Eye Serum,37.57,4.34,True
Power Advanced Wrinkle Fighter 360° Eye Serum,95.54,3.73,False
Targeted Pores Serum With Bha + Pha,49.73,4.1739,True
Peptide 21 Amino Acid Scrub Scrub Pads,135.96,4.3,True
Honey Grail Ultra-Hydrating Face Oil,39.88,4.1409,False
3 Mega Wonders,65.54,3.6684,False
C.E.O. Afterilluminate Lighteninging L-Ascorbic Hydrater,65.66,4.86,True
Mini Cream Skin Toner & Moisturizer,97.61,4.4762,True
Mini Revitalizing Supreme+ Youth Power Creme Hydrater,8.45,4.1408,True
Inflam-Aging Night Repair Treatment,120.53,4.05,True
Mini 24-7 Moisture Hydrating Day & Night Cream,125.66,4.14,False
Multi-Active Firmr,67.67,4.19,True
Blackhead Solutions Self-Heating Blackhead Extractor,11.36,3.73,False
Mini Multi-Active Tightenr,172.81,4.19,True
Skinpower Essence Serum,91.5,3.87,False
Play 100% Mineral Lotion Shield 30 With Green Algae,92.85,4.27,True
Pumpkin Enzyme Mask Enzymatic Dermal Resurfacer,66.46,4.14,False
Future Solution Lx Concentrated Mattifying Softener,42.0,3.89,True
Pure Lip Balm & Exfoliating,8.87,4.39,True
Self Tan Express Bronzing Gel,11.4,3.57,False
Ageless Revitalizing Neck Cream,23.24,3.87,False
Strengthening Nighttime Ritual Set,159.59,3.33,False
Prep Set Tan Face And Body Brush,180.22,4.0,False
Prep Set Tan Face And Body Brush,18.56,4.0,False
Mini Cloud Dew Oil-Free Gel Cream,55.2,3.48,False
Mini Rose Quartz Facial Roller,43.46,2.96,False
Overnight Restorative Cream,93.61,4.45,False
Outsmart Acne Purifying Treatment,47.08,3.71,False
Full Spectrum 360° Sun Silk Drops Natural Sunscreen Defend 30,23.64,4.4375,True
Gooplight-Reflecting Light-Reflecting Lotion,79.06,4.35,True
Zero Baggage Anti-Dark Circle Eye Cream,162.89,3.57,False
Tranexamic Acid Hyperpigmentation Treatment,5.34,3.48,False
Salicylic Acid Acid Acne Treatment Serum,30.2,4.17,True
Purifying Blemish & Oil Control Purifyr,98.76,4.19,True
Sea Mini Drink Of H2O Hydrating Enrich Moisturizingr,44.18,4.14,True
Peptight  360˚ Liftinging Eye Serum,72.64,4.19,True
Multi-Active Anti-Aging Night Hydrater For Radianceing Skin,57.77,4.72,True
Mini Clearly Corrective Dark Spot Correcting Serum,46.23,3.4,False
Tightenx Collagen Moisturizer,78.36,4.5741,True
Mini Drink Up Intensive Overnight Hydrating Mask With Avocado & Swiss Glacier Water,185.75,4.13,False
Hydrationr Mini Knockout Glowing Gel,74.75,4.53,True
Umbrian Clay Pore Cleanseing Face Mask,12.65,4.0,True
Advanced Night Micro Cleansing Balm,36.3,4.0,True
Beauty Sleep Overnight Restore Treatment Cream With Aha'S And Magnesium Ascorbyl Phosphate,36.0,4.78,True
Amethyst Roller,156.89,3.61,False
Jasmine Green Tea Oil Control Firmr,172.22,4.36,True
Juneberry & Hydrolyzed Collagen Hydrating Cold Cream Clarifyr,29.9,4.3596,True
Turmeric Glow Foaming Clarifyr,31.19,4.35,True
Mini Retinyl Youth Repairal Serum,70.07,4.5707,True
Milky Mushroom Gentle Naturalsing Oil Makeup Remover,49.32,4.0065,True
Triple Polyoligopeptides Hydrating + Tighten Oasis Serum With Hyaluronic,36.78,4.87,True
Dewy Pout Duo,177.72,4.125,True
Refine Glycolic Acid + Salicylic Acid Texture & Pore Serum,61.8,4.4624,True
Orchid Antioxidant Beauty Face Oil - For Combination Skin,109.7,3.41,False
Isle Body Oil Spf 30 With Sea Moss And Squalane,81.34,4.26,True
The Tonic,33.42,3.49,False
Mini City Skin Age Defense Broad Spectrum Spf 50 Pa++++,79.73,4.2616,True
White Lucent Anti-Dark Circles Eye Cream,171.97,2.67,False
High-Potency Night-A-Mins Oil-Free Resurfacing Cream With Fruit Derived Glycolic Acids,66.99,4.13,True
The Nightly Retinol Palmitate + Peptide Age-Defying Serum,77.74,4.8,True
Black Tea Anti-Aging Moisturizingr With Retinoate-Alternative Bt Matrix,70.49,4.876,True
Sunilluminate Vitamin C + Squalane Face Oil,34.5,4.79,True
Fix  Line Smoothing Device,42.71,4.02,False
Glopro Eye Microtip Attachment Head,155.07,4.35,False
Facial Radiance B3 Dark Spot Serum,33.33,4.67,True
Detoxifyinging Contouringr,8.82,4.19,True
Power Starters Firm Trio,184.59,4.19,True
Liquid Exfolikate Triple Acid Resurfacing Treatment,150.37,3.63,False
Restorative Vitamin B3 Night Cream,28.66,4.94,True
Oil And Pore Control Mattifier Broad Spectrum Spf 45 Pa++++,102.02,4.2637,True
Purifying Pore Detox Clarifyr,43.84,4.0,False
The Essence,88.85,3.78,False
Night Illuminate Self-Tan Face Mist,5.3,4.3483,True
Dermask Intra Jet Tighteninging Solution,9.05,4.56,True
Advanced Night Repair Concentrated Eye Treatment Mask,42.95,4.05,True
Detoxing Blemish & Oil Control Detoxifyingr,144.02,3.8889,True
Superfruit Gentle Radianceing Detoxr,35.75,4.3488,True
Violet-C Brightening Serum 20% Vitamin C + 10% Glycolic,57.07,4.94,True
Green Clean Makeup Removing Cleansing Balm,17.72,4.0,True
Thirst Trap Juice Hyaluronic Acid Acid & Oligopeptides Hydrating Facial Serum,46.43,4.77,True
Lotus Youth Preserve Rescue Mask,184.78,3.27,False
Superkind Fragrance-Free Fortifying Moisturizer,131.38,4.13,True
Super Multi-Corrective Age-Defying Eye Cream,120.86,4.1988,True
Mini Alpha Beta Ultra Gentle Daily Exfoliate Pads For Sensitive Skin,93.91,2.77,False
Abeille Royale Intense Repairing Youth Oil In Balm,77.03,4.05,True
Skin Warrior Moisture Rescue Cream,182.54,2.65,False
Milky Jelly Gentle Gel Face Detoxr,68.92,3.6314,False
Squalane + Peptide Brightening & De-Puffing Eye Gel,43.93,4.77,True
Delikate Try Me Kit,177.3,3.59,False
Aha 30% + Bha 2% Exfoliation Peeling Solution,20.7,4.4633,True
The C Drops – 20% Ascorbic Blend Illuminateing Serum,65.9,4.61,True
Marine Hyaluronics,75.62,4.4,True
Santorini Grape Poreless Skin Cream,80.05,3.01,False
Mini Alpha Beta Aha/Salicylic Acid Daily Chemical-Freesing Gel,8.42,4.56,True
Honey Halo Quenchr Jumbo,118.11,4.1429,True
Eradikate Beta Hydroxy Acid Acid Acne Treatment,25.38,4.54,True
Mattifying Act Revitalizeing & Ph Mattifying Biodegradable Toner Pads,57.06,4.36,True
"Youth Stacks: Hydrate It Up For Dry, Dehydrated Skin",169.86,4.12,True
Clear Daily Skin Clearing Treatment With 2.5% Benzoyl Peroxide,19.62,4.3,True
Advanced Génifique Glow Enriching Face Serum,115.12,4.35,True
Super Nova 5% Thd Ascorbic Acid + Caffeine Illuminateing Eye Cream,60.43,4.62,True
Face Mask,107.91,3.85,False
Goopglow Slough Off Dark Spot Sleep Serum,9.52,4.3428,True
Mini Floral Heal Overnight Mask With Squalane,49.95,4.05,True
The Repairthy Skin Edit Bestsellers Kit,34.15,4.05,True
Chemical-Free Hydration Factors + Ha,6.5,4.36,True
Milky Mushroom Gentle Cleansing Oil Makeup Remover,57.16,3.9918,True
"Youth Restoreal Hydroxypinacolone Retinoate Trial Kit For Smoother, Younger-Looking Skin",35.14,4.74,True
Advanced Génifique Hydrogel Melting Mask,175.36,2.46,False
The Clarifying Kit,41.38,3.43,False
Nutritious Super-Pomegranate Radiant Energy Night Hydrationr Creme/Mask,75.77,4.53,True
Baba Bomb Moisturizer,18.64,4.12,True
Capture Totale Super Potent Clarifyr,128.51,3.31,False
One Essential Skin Nourishinging Super Serum,62.52,4.4532,True
The Bright Set,113.26,3.77,False
Pore Remedy Purifying Mud Mask,109.4,2.79,False
Advanced Night Micro Non-Toxicsing Foam,64.85,4.0,True
Oil Free Hydrationr,86.21,4.12,True
Dew Good Illuminating Serum Spf 30,50.1,4.73,True
Chia + Moringa Algae Enzyme Organicsing Oil,37.84,4.0,True
Mineral Sheerscreen Sunscreen Barrier 30 Pa+++,145.56,4.25,True
Cryo Rubber Mask With Comforting Allantoin,84.71,4.01,True
Black Tea Corset Cream Liftinging Hydrationr,22.29,4.4758,True
Superbeauty Daily Antioxidant Skinsupplement,31.48,3.52,False
Enzyme Purifyr,69.41,3.39,False
Banana Bright+ Ascorbicc Eye Sticks,61.39,4.25,True
Mini Take The Day Off Non-Toxicsing Balm Makeup Remover,23.18,3.9935,True
Even Smoother Glycolic Retinyl Resurfacing Serum,142.87,4.6316,True
B-Hydra Intensive Hydration Serum With Hyaluronic Acid,93.35,4.6106,True
Vitamin Tonic,97.8,4.92,True
Gold Liftinging Bar,99.2,4.2,True
100% Sugarcane Squalane Oil,85.55,3.48,False
Extra-Tightening & Smoothing Day Moisturizer With Shield 15,68.98,4.9,True
Noni Brighten Brightening Eye Oil,124.78,4.5631,True
Illuminating Hydrator - Glow + Smoothing,106.28,4.68,True
Ginzing Energizing Gel Cream With Caffeine & Niacinamide,43.31,4.38,True
The Eye Cream With  Tfc8,138.55,3.63,False
Mini Grape Water Moisturizing Face Mist,34.83,4.13,True
Sea Silk Lip Balm,102.61,3.8,False
Luna 4 Facial Cleansing & Firm Massage For Combination Skin,118.93,4.39,True
The Water Cream Oil-Free Pore Minimizing Hydrater,108.58,4.31,True
"Facial Spray With Aloe, Herbs And Rosewater",64.32,3.64,False
Omega Water Cream Hydrater,73.86,4.125,True
Kombucha + 10% Glycolic Liquid Exfoliant With Lactic Acid Acid And Glycolic Acid,72.17,4.4,True
C.E.O. 15% Ascorbic Shineing Serum,21.28,4.61,True
Auto Correct Illuminateing + Depuffing Eye Cream For Dark Circles,86.84,4.34,True
Acne+ 2% Salicylic Acid + Azelaic Acid + Niacinamide + Glycolic Deep-Chemical-Freer,15.61,4.81,True
24-7 Power Swipe Hydrating Day & Night Treatment Eye Balm,185.56,4.125,False
Crystal Ball Roller Gloss,32.72,3.82,False
Skinlongevity Long Life Herb Repair Face Serum,75.02,4.05,True
Calendula Petal-Infused Calming Mask With Aloe Vera,52.52,4.02,True
15% Niacinamide Gel Serum,90.65,4.38,True
The Canopy Humidifier Starter Set,98.53,3.81,False
Acne+ 2% Beta Hydroxy Acid And Azelaic Acid Acne Spot Treatment,46.73,4.17,True
The Eyelighter Concentrate,100.28,3.5,False
Natural Smart Facial Naturalsing Device,34.92,3.9987,True
Magic Cream Water-Infusedr With Hyaluronic Acid,73.47,4.62,True
Illumi-Nation Anti-Fatigue Power Serum,152.72,4.3477,False
Acne Facial Purifyr,139.31,3.6311,False
Skin Resurfacing Lactic Acid Acid Detoxifyingr,25.63,4.0259,True
A1 Palmitate Youth Repairingal Eye Masks,72.84,4.57,True
Glow Dewy Skin Mist,60.41,4.53,True
The Eyelighter Concentrate,70.88,3.02,False
Detoxing Cleansing Brush Head Refill,45.18,3.9965,True
Massaging Jade Textured Facial Roller,23.71,3.47,False
Multi-Active Age-Defying Day Moisturizer For Glowing Skin,59.99,4.72,True
Argan Bright Skin Vitamin C Serum,63.05,4.57,True
Strawberry Salicylic Acid Pore-Smooth Blur Drops,31.57,4.18,True
Makeup Setting Spray Chemical-Free Sunscreen Barrier 30,23.6,4.44,True
Mini Green Beautysing Wipes - Coconut Water,108.36,3.9956,True
Paradisi Hydrating Essence Mist,90.56,4.13,False
10% Azelaic Acid Nourishinger,99.72,4.05,True
10 + 10 Water-Infusedr With 10% Vitamin C + 10% Oligopeptides Complex + Ceramides,82.61,4.9,True
Revitalizing Supreme+ Bright Soft Creme Moisturizer,124.86,4.125,True
Genoptics Spot Essence Serum,59.65,3.69,False
Botanical Slough Off Exfoliate,47.34,3.7,False
Niacinamide Oil Control Serum,60.68,4.49,True
Benefiance Wrinkle Smoothing Day Cream Anti-Pollution 23,37.6,4.45,True
Jasmine Green Tea Oil Control Tightenr,12.33,4.37,True
Calm Water Gel Water-Infusedr,56.17,4.1343,True
Hyaluronic Eye Cream,33.96,4.4,True
Refine Aha + Salicylic Acid Texture & Pore Serum,59.18,4.46,True
Mini Goddess Clay Mask 15Ml Travel Size,79.87,3.35,False
Beta Hydroxy Acid Acid 2% Exfoliating Blemish Solution,22.0,4.49,True
High-Potency Night-A-Mins Oil-Free Resurfacing Cream With Fruit Derived Glycolics,20.17,4.13,True
The Light Cream,131.32,3.8,False
Vinogreen Beauty Gentle Foam Clarifyr,24.43,3.9995,True
Outsmart Acne Clarifying Treatment,139.31,3.4286,False
Microdermabrasion Peel,38.37,2.63,False
The Tone Eye Serum,50.15,4.2,True
Blue Light Protection+ Triple Lipid + Collagen Radianceing Eye Treatment,30.72,4.69,True
Ultracalming Serum Concentrate,131.66,4.02,True
Eradikate Acne Treatment,82.99,4.34,False
Yuzu-C Eye Awakening Essence,177.4,3.7473,False
