product_name,price_usd,rating,has_term
Ascorbic Lactic 15% Tone & Bright Serum,43.56,4.67,True
Dermask Water Jet Soothing Hydra Solution,140.94,4.02,True
10 Day Results Kit,119.52,3.55,False
Mini Squalane + L-Ascorbic Rose Contouringing Oil,23.63,4.51,True
Wrinkle Reducer Trinity Attachment,92.2,3.59,False
Squalane + Omega Regenerate Deep Hydration Hydrationr,42.91,4.4299,True
Delikate Calming Detoxr,19.19,4.02,True
Pro Strength Vitamin A/C/E Retinoid Treatment,145.93,4.83,False
Euk 134 0.1%,56.83,3.43,False
Wing Man Liver Purify And Dark Circle Supplement,12.99,3.54,False
Over It Magic Self-Tan Eraser,165.22,3.56,False
Ferulic Brew Facial Treatment Essence With Lactic Acid,58.52,4.0263,True
Sleep Oil Rejuvenating Miracle Tanning Oil,21.06,4.1883,False
The Detoxing Kit,44.96,3.87,False
Mini Alpha Beta Alpha Hydroxy Acid (Aha)/Salicylic Acid Daily Chemical-Freesing Gel,48.51,4.57,True
Zincscreen 100% Mineral Sunscreen Lotion Shield 40 Pa+++,87.78,4.27,True
Brighten One Step Further Luminous Kit,21.47,4.57,True
Soothe + Moisturize Shield Building Hydrosol Mist,47.54,4.49,True
Botanical Exfoliate Scrub,24.12,3.35,False
City Block Sheer Oil-Free Daily Face Protector Broad Spectrum Protect 25 Primer,63.54,4.2442,True
Honeymoon Glow Aha Resurfacing Night Serum,41.29,4.53,True
Anti-Aging Cleansing Gel,15.29,4.38,True
Evercalm Gentle Cleansing Gel,45.1,3.97,True
Super Amino Gel Purifyr,117.76,3.8,False
Cleansing & Hydrating Bestseller Set Bento Box,13.16,4.37,True
Private Party: Supports Vaginal & Urinary Tract Rejuvenateth,21.32,4.1989,True
Lip Sleeping Mask Intense Hydrate With Vitamin C,32.2,4.72,True
Sculpting Vegan Collagen Prep Serum,110.9,4.47,True
Pmd Personal Microderm With Hand & Foot Kit,20.24,3.56,False
Mini Goopluminous 15% Aha Acid Overnight Luminous Exfoliate,74.03,4.53,True
Future Solution Lx Eye And Lip Contour Regenerating Cream,74.79,4.05,False
Luxury Sun Ritual Pore Smoothing Sunscreen Protect 30,49.07,4.45,True
Silk Sleepmask,85.23,3.83,False
T.L.C. Framboos Glycolic Resurfacing Night Serum,39.77,4.13,True
Invisible Shield Water-Gel Transparent Sunscreen Protect 35,80.66,4.24,True
Mini Fulvic Acid Glowing Detoxifyingr,16.18,4.34,True
Wishing You Essentials Skincare Kit,154.2,3.6,False
Natural Peeling Mask,18.02,3.97,True
N°39 Facial Sunscreen Mist With Spf 39,73.11,4.24,True
Bouncy Brightfacial Luminousing Mask With 10% Azelaic Acid + 1% Salicylic Acid,172.09,4.54,True
Sweet Biome Fermented Sake Hydrating Spray,30.03,4.16,False
Turbo Body Lotion Energizing Gel Moisturizingr With Eucalyptus & Aloe,105.15,4.15,True
Plantscription Vitamin A1 Night Hydrater,53.54,4.8947,True
Protini Powerpeptide Resurfacing Serum With Lactic Acid,128.97,4.49,True
Eradikate Acne Treatment,158.16,4.32,False
Glow Daily Ascorbic Acid Gel Cream,76.66,4.6,True
Daily Reveal  Exfoliating Face Pads With Alpha Hydroxy Acid (Aha) + Salicylic + Pha + Txa,37.72,4.67,True
Fab Pharma Calamine Pore Purging Mask,91.99,4.01,False
La Mousse Off/On Foaming Face Cleanser,33.48,3.9,True
Daily Milkfoliant Exfoliator,44.04,3.48,False
Calm Sweet Calm Stress Management No Animal Testing Gummies With Ashwagandha & L-Theanine,93.14,3.88,True
5 Stars A1 + Niacinamide Eye Serum,26.29,4.7,True
Ceramidin Skin Protect Serum Contouringr,80.32,4.67,True
High Performance Eye Cream For Dark Circles With Hyaluronic Acid,97.69,4.39,True
Satocane Pore Clarifying Exfoliating Mask,22.12,4.2222,False
Aqua Bomb Overnight Lip Mask,70.1,3.54,False
Illuminate Peel Pads With Glycolic Acid + Pha,139.03,4.53,True
Ultra Even-Tone Mask With Vitamins C + E,70.85,4.89,True
Acne Solutions Deep-Non-Toxicing Lotion,65.31,3.95,True
Sea Mermaid Skin Hyaluronic H2O Serum,60.55,4.3959,True
Ceramidin Skin Shield Serum Contouringr,27.76,4.6705,True
Clean Skin Gel Cleanser With Prebiotics,66.65,3.95,True
The Kissu Lip Mask,50.49,3.52,False
Buttermask Intense Restore Lip Treatment,68.96,4.44,True
Original Skin Matte Moisturizer With Willowherb,29.74,4.12,True
Private Party: Supports Vaginal & Urinary Tract Repairth,60.81,4.0376,True
Get Even Rose Face Oil,120.64,3.78,False
Brumisateur Natural Mineral Water Facial Spray Travel Trio,57.95,3.95,True
Superclay Purify + Clear Power Mask With Niacinamide,73.43,4.37,True
Invisible Physical Defense Mineral Sunscreen Shield30,55.22,4.24,True
Mini Cicapair Tiger Grass Color Correcting Treatment Defend 30,26.68,4.24,True
Skin-Brighteninging Dual Facial Enzyme Exfoliator,167.95,4.5556,True
Even-Toneing Dark Circle Eye Cream,71.54,4.5556,True
Capture Youth Age-Delay Progressive Exfoliatinging Crème,22.06,4.2,False
The Youth System,11.78,3.7,False
Noni Glow Quenching Face Oil,74.84,4.53,True
Pep-Start Daily Uv Shieldor Broad Spectrum Defend 50,7.44,4.26,True
Paradisi Hydrating Essence Mist,189.14,4.1042,False
The Regenerating Serum,171.88,4.04,False
Hydrating Water Fresh Cream Quenchr,12.39,4.1111,True
Benefiance Clean Vitamin A1 Intensive Revitalizing Face Mask,67.43,4.87,True
The Weighted Razor Kit,155.5,3.8478,False
4.5% Retinyl Acetate Palmitate Serum,49.36,4.42,True
Aqua Bomb Jelly Detoxifyingr,98.46,3.29,False
Omega Water Cream Hydrater,54.71,4.0954,True
C5 Super Feed L-Ascorbic Acid Eye Cream,52.38,4.2613,True
Rose Petal-Soft Deep Moisturizing Lip Balm,186.08,4.0959,True
Dermask Intra Jet Liftinginging Solution,103.11,4.19,True
Mini Brighten2Oh Dark Spot Contouringr,46.58,4.5556,True
Lotus Youth Preserve Rescue Mask,92.15,3.63,False
The Quench Serum Resurfacing And Quenching Treatment,70.92,4.0955,True
Mini Ultra Facial Water-Infused Cream With Squalane,81.66,4.09,True
Moisturizinging Power Duo,89.94,4.09,True
Mini Urban Environment Oil-Free Sunscreen Broad-Spectrum Spf 42,65.07,4.26,True
Lip Butter Balm,121.68,3.33,False
Mini Noni Shine Face Oil,64.22,4.33,True
Goopgenes Enriching Heal Body Butter,183.57,4.04,True
Smart Clinical Heal Wrinkle Correcting Eye Cream,121.46,4.04,True
Dr. Andrew Weil For Origins Mega-Bright Protect 30 Skin Sculpt Correcting Oil-Free Hydrater,86.82,4.69,True
Mandelic Acid Treatment,70.24,3.7333,False
Bright & Tight Dark Circle Toneing Eye Cream With Vitamin C & Polypeptides,93.33,4.95,True
Premium Bb Tinted Hydrater With B3 And Shield 40,42.98,4.8299,True
Bakuchiol Hydrating Detoxr,90.71,4.11,False
Bye Bye Makeup 3-In-1 Makeup Melting Cleansing Balm,56.61,3.9,True
B3 Oil Control Serum,9.7,4.49,True
Genius Ultimate Anti-Aging Melting Chemical-Freeser,40.53,4.38,True
Special Chemical-Freesing Gel,49.59,3.9,True
Rose Even-Tone + Get It Anti-Inflammatory & Even-Firming Eye Balm,21.16,4.69,True
Squalane + Hyaluronic Toning Mist,127.8,4.3972,True
The Texture Tonic Glycolic Liquid Scrub Treatment,59.38,4.11,True
15% Ascorbic Acid + Clean Caffeine Energy Serum,59.87,4.4063,True
Ultra Repair Face Moisturizer,47.18,4.4,True
Ultra Sun Sun Protectionion Lotion Broad Spectrum Defend 50+ Wetforce For Sensitive Skin & Children,9.29,4.25,True
Mini Moisture Surge 100H Auto-Replenishing Hydrator Quenchr,48.0,4.15,True
Hydrating Face Cream Moisturizer,159.53,4.08,True
Luminosity Sweet Luminosity - Skin Hydration Cruelty-Free Gummies With Hyaluronic Acid & L-Ascorbic Acid + E,20.38,4.9,True
Alpha Beta Aha/Bha Daily Chemical-Freesing Gel,32.63,4.5474,True
Capture Youth Glow Booster Age-Delay Illuminating Serum,111.8,4.35,True
The Hydrate Matte Lotion,35.09,4.08,True
Advanced Night Micro Naturalsing Balm,70.39,3.92,True
Plush Puddin’ Intensive Heal Lip Mask With Pomegranate Sterols + Vitamin E,106.65,4.7073,True
Counter Cravings - Helps Reduce Cravings And Nourishings Metabolism,76.22,4.04,True
Vital Perfection Uptighten And Toneing Cream Day Cream,127.23,4.18,True
G.Tox Malachite And Fruit Acid Pore Clarifying Detoxr,77.38,2.93,False
Sunless Tan Dry Body Oil Mist,105.83,3.45,False
Gradual Tan Classic Daily Youth Feeding Cream,110.35,3.18,False
Mini Skin Resolution Purifying Acid Liftingr,9.05,4.236,True
Hydro Ungrip Makeup Remover + Green Beautysing Water,9.39,3.9216,True
Fulvic Acid Lighteninging Clarifyr,32.48,4.56,True
Rose Hibiscus Hydrating Mist,127.82,4.0816,False
Squalane + Elderberry Rejuvenateing Jelly Clarifyr,33.88,4.2391,True
One Essential Eye Serum,43.13,4.2392,False
Youth Junkie Activated Mask,101.36,2.3,False
Vinoperfect Glowing Glycolic Acid Essence,54.13,4.5303,True
The Porefessional Deep Retreat Pore-Clearing Clay Mask,94.62,2.21,False
Mini Facial Treatment Essence (Pitera Essence),176.83,3.81,False
Radianceing Saffron Serum - Even-Tone Rani,134.5,4.5457,True
Ascorbic Lactic Firm & Bright Eye Treatment,90.18,4.85,True
Watermelon Glowing Serum,61.93,4.34,True
Mini Cloud Dew Oil-Free Gel Cream,53.02,3.49,False
The Cream With Tfc8 Face Hydrationr,91.59,4.1245,True
Cruelty-Free Milk Clarifyr,44.68,3.88,True
Skin Changer Succinic Acid Essence-Tightenr,181.68,4.2,True
Omega+ Complex Serum,6.39,3.01,False
Oil-Absorbing Pore Treatment Strips,14.73,3.2727,False
Ascorbyl Glucoside Solution 12%,141.99,4.24,False
Faded Serum For Dark Spots & Discoloration,52.48,2.83,False
Mini Acne Solutions Non-Toxicsing Foam,111.18,3.9926,True
Mini Jet Lag Mask,134.06,2.96,False
Overnight Radiance Dark Spot Sleeping Cream,106.55,4.35,True
30% Alpha Hydroxy Acid (Aha) Acid Peel Concentrate,99.19,4.1212,True
Mini The Moisturize Skin Cream,62.62,4.12,True
Vinosource-Hydra Moisturizing Mask,18.12,4.12,True
Capture Totale Super Potent Eye Serum,73.72,3.5,False
High-Potency Night-A-Mins Oil-Free Resurfacing Cream With Fruit Derived Alpha Hydroxy Acid (Aha)S,74.52,4.12,True
Water-Lock Moisturizingr With Skin-Smoothing Acetyl Hexapeptide-8S,82.59,4.66,True
Mini The Concentrate Serum,97.75,3.55,False
Every. Single. Face. Watery Lotion Defend 50,104.0,4.25,True
Glo Brilliant Teeth Whitening Glo Vials 10 Pack Plus Lip Care,117.33,4.3509,False
Mini Tl Advanced  Sculpting Neck Cream Plus For Toneing & Skin-Brighteninging,77.8,4.5474,True
Dewtopia 20% Acid Night Treatment,36.56,4.1535,False
Poredermabrasion Pore Perfecting Exfoliator,15.92,3.57,False
Hydro Ungrip Makeup Removing Naturalsing Balm,73.92,3.96,True
Soothing Serum,52.16,4.02,True
Instant Reset Illuminateing Overnight Restore Gel-Cream With Niacinamide Refill,24.21,4.87,True
Peptides 21 Amino Acid Exfoliating Exfoliating Pads,74.79,4.52,True
Bye Bye Bumps - Best Of Body Kit,122.52,3.79,False
Epidermal Re-Texturizing Micro-Dermabrasion,115.15,2.43,False
Cicapair Tiger Grass Soothing Serum Mask,63.19,4.02,True
Squalane + Bha Balancing Contouringr,117.81,4.5473,True
Moisturize & Illuminate Trio,23.34,4.53,True
Take The Day Off Cleansing Balm Makeup Remover,22.2,3.96,True
Double Serum Eye Liftinging & Hydrating Age-Defying Concentrate,59.19,4.47,True
Wrinkle Release Neck & Chest Sheet Mask,83.66,3.84,False
That Big Screen Moisturizer With Broad Spectrum Barrier 30,55.78,4.5,True
Sunless Tan Express Toneing Mousse,58.62,4.23,True
Calendula Deep Clean Foaming Face Wash,17.38,3.97,True
Honey Halo Water-Infusedr Jumbo,172.7,4.08,True
Gradual Self-Tanning Face Gel,57.72,3.6,False
Sugar Face Exfoliating Exfoliator,43.72,4.21,False
Mineral Sunscreen Zinc Oxide Broad Spectrum Defend 30,48.13,4.2525,True
Vinoclean Chemical-Freeseing Clay Mask,38.78,3.91,True
Glopro Prep Pads Detoxing Skin Naturalsing Wipes With Polypeptidess,31.74,4.7,True
Squalane + Omega Regenerate Deep Quench Quenchr,14.52,4.4134,True
Adaptogen Soothe + Hydrate Activated Mist With Peptidess,32.65,4.51,True
Mini Acne Control Clarifying Deep-Organicr,57.71,3.91,True
Bear Facial Toning Device,134.59,3.39,False
Counter Cravings - Helps Reduce Cravings And Boosts Metabolism,86.95,2.89,False
Confidence In Your Beauty Sleep Night Cream,19.04,3.2,False
Squalane + 10% L-Ascorbic Dark Spot Serum,22.82,4.24,True
Mask And Moisturize Duo Skincare Gift Set,16.81,4.13,True
Water-Infused & Luminous Trio,53.09,4.5311,True
Bio-Performance Advanced Super Revitalizing Cream,48.1,3.5,False
Even Smoother Glycolic Acid Retinol Resurfacing Polish Pads,20.04,4.63,True
Classic Face Sunscreen Shield 50 White Tea,108.59,4.24,True
Power Advanced Wrinkle Fighter Hydrationr,64.35,4.12,True
Rénergie H.C.F. Triple Serum: For Moisturizeing & Wrinkle-Reducing,66.35,4.48,True
10% Nicotinamide Replenisher,105.16,4.3713,True
Daily Essentials Travel Set,154.23,3.82,False
Instant Moisturize Set,27.76,4.12,True
Absolue Revitalizing Eye Cream,100.35,3.72,False
Clinical Lipids-Nourished Firming Eye Cream,47.13,4.63,True
Lemonade Smoothing Exfoliating,19.59,4.43,False
Hydra Vizor Invisible Hydrater Broad Spectrum Protect 30 Sunscreen With Vitamin B3 Refill,57.12,4.9474,True
Clarifying Water Gel Hydrationr With Hyaluronic Acid Acid,183.99,4.63,True
Equilibrium Intensive Hydrating Eye Balm,13.41,4.1,False
The Hydration Cool Gel Cream,87.95,4.14,True
Skin Smoothing Cream Moisturizer,181.04,4.3831,True
Luna 4 Go Facial Cleansing & Massaging Device,66.52,3.98,True
Alpha Beta Daily Plumpr,53.79,4.1,True
Baba Bomb Plumpr,88.44,4.1,True
Cleansing Serum,23.79,3.98,True
Puresing Spa Water Cloths,9.22,3.98,True
Hyaluronic Facial Cream,16.29,4.39,True
Self Tan Express Bronzing Gel,102.59,2.5,False
Smoothing Ascorbic Eye + Expression Lines Cream,71.76,4.4571,True
Smart Response Serum,81.88,3.7724,False
High-Potency Night-A-Mins Resurfacing Cream With Fruit-Derived Alpha Hydroxy Acid (Aha)S,87.89,4.1,True
Argan Beta A1 Pink Algae Serum,98.42,4.4132,True
The Moisturizing Serum Resurfacing And Hydrateing Treatment,73.13,4.14,True
5% Benzoyl Peroxide Acne Spot Treatment,27.85,4.01,True
Pre-Show Luminous Instant Retexturizing 10% Aha Treatment + Reusable Applicator,42.75,4.67,True
Acne-Clear Essentials 4-Piece Acne Kit,164.46,2.39,False
Ceramidin Skin Defend Moisturizing Cream,50.94,4.66,True
Repairingwear Upsculpt Sculpting Cream,37.5,4.4494,True
Mini Solar Power Shine Barrier 30 Serum,26.22,4.59,True
Rose Quartz Gua Sha,121.04,2.22,False
T.L.C. Sukari Babyfacial Glycolic Acid + Salicylic Acid Mask,21.48,4.46,True
Water-Infusing Electrolyte Moisturizer,62.1,4.09,True
Complexion Illuminateing Nourishinger Serum,136.85,4.5185,True
Plumping Power Duo,24.62,4.07,True
Retinyl Acne Clearing Oil,33.56,4.4037,True
Electro-Lite Enzyme Luminousing Gel Detoxifyingr,38.65,4.3243,True
10% L-Ascorbic Glowing Serum,42.0,4.63,True
Triple Ascorbic Light-Reflectinging Bounce Cream Moisturizer,35.08,4.739,True
10% Waterless Sodium Ascorbyl Phosphate Serum,42.51,4.28,True
Milky Jelly Gentle Gel Face Detoxr,55.43,3.35,False
Hydrating Eye Cream,49.49,4.068,True
Mini Mandelic Acid + Superfood Unity Exfoliant,105.27,3.45,False
Ginzing Into The Illuminate Glowing Serum,72.44,4.3233,True
Salicylic Acne Repairinging Dots,177.63,4.44,True
24-7 Power Swipe Hydrating Day & Night Treatment Eye Balm,101.97,4.08,False
Concentrated Ginseng Renew Cream Classic,101.16,4.05,True
Ultra Facial Oil-Free Gel Cream,112.17,3.8308,False
Ceramidin Skin Defend Hydrate Mask,49.42,4.6607,True
Delikate Regenerate Cream,104.11,4.05,True
Superkind Fragrance-Free Softening Green Beautyser,56.11,4.0,True
Trinity Facial Toning Device + Wrinkle Reducer Attachment Bundle,92.14,3.07,False
Ting Energy + Metabolism Non-Stim Supplement With Ginseng,159.95,3.61,False
Universal Pro-All-Trans Retinaldehyde Overnight Healing Treatment,71.47,4.5825,True
Mini Lotus Anti-Wrinkle Night Moisturizingr,68.29,4.48,True
The True Cream Hydration Bomb,82.97,4.09,True
Facial Chemical-Freesing Tool,112.33,3.99,True
Wrinkle Release Facial Sheet Mask,25.54,3.81,False
Plump + Juicy Plant-Based Collagen + Probiotic Spray-On Serum,6.98,4.45,True
Even Skin Tighten Self-Tanning Body Butter,145.68,4.19,True
Jet Lag Mask,66.47,2.24,False
Pore-Mattifying Facial Sauna Scrub,35.19,3.89,True
Greek Yoghurt Foaming Cream Deep-Cleanr,80.43,3.99,True
Extra-Toneinging & Smoothing Face Mask,146.38,4.4089,True
Satocane Pore Clarifying Scrub Mask,5.97,3.8,False
Perfectly Non-Toxic Multi-Action Toning Lotion/Refiner,98.57,3.99,True
Personal Microderm,66.72,3.25,False
Menoreverse Volumizing Serum-In-Quenchr,126.91,4.09,True
Barrier+ Triple Lipid-Acetyl Hexapeptide-8 Face Cream,35.84,4.5455,True
100 Percent Pure Argan Oil,119.84,3.99,True
Strawberry Lip Balm,113.48,3.77,False
Capture Totale Le Sérum Anti-Aging Serum,147.31,4.19,True
Strawberry Bha Pore-Smooth Blur Drops,21.73,4.17,True
Hydrating Ultra Regenerate Cream Duo,144.5,4.4087,True
Hydra Vizor Invisible Hydrater Broad Spectrum Protect 30 Sunscreen With B3 + Kalahari Melon,117.94,4.85,True
Omega + Complex Cleansing Balm,44.32,3.98,True
"Facial Spray With Aloe, Cucumber And Green Tea",76.33,3.7,False
Self-Tan Luxe Whipped Crème Mousse,26.71,3.63,False
Blueberry Bounce Gentle Purifyr,57.71,3.62,False
Soft Non-Toxic Moisture Rich Foaming Non-Toxicser,13.53,3.99,True
Future Solution Lx Total Barrierive Emulsion Broad Spectrum Shield 20 Sunscreen,42.66,4.26,True
Supplement Case,183.49,3.56,False
Shikulime Mega Hydrating Quenchr,135.55,4.15,True
The Face Cream Mask,95.17,3.52,False
Lift & Contour 1% Bakuchiol & Oligopeptides Eye Serum,24.57,4.3,True
Instant Pore Perfector,50.12,3.68,False
Advanced All-Trans Retinyl Acetate Nightly Multi Correct Serum,102.35,4.4234,True
Kateceuticals Tighteninginging Serum With Hyaluronic,64.89,4.81,True
Salicylic Acid Acne Treatment Serum,52.23,4.17,True
Mini Revitalizing Supreme+ Youth Power Creme Dewyr,164.89,4.08,True
Mini Acne Control Purifying Detoxifyingr,30.17,3.21,False
Potent-C Power Brightening Hydra-Gels,133.17,4.57,True
Turbo Body Lotion Energizing Gel Moisturizingr With Eucalyptus & Aloe,6.48,4.14,True
Kateceuticals Firming Serum With Hyaluronic,100.36,4.64,True
The Kissu Lip Mask,81.21,2.51,False
Daily Dose Hydra-Ceramide Revitalize + Spf 40 Sunscreen Oil Pa+++,31.15,4.47,True
Fade And Luminous Glycolic Acid Mask,40.64,4.53,True
The Camellia Oil 2-In-1 Makeup Remover & Deep-Non-Toxicr,100.91,3.97,True
Multivitamin Power Firm Eye Cream,166.33,4.75,True
Ting Energy + Metabolism Non-Stim Supplement With Ginseng,26.02,3.86,False
Reusable Cotton Pads,89.88,3.84,False
Peptide 21 Amino Acid Exfoliating Exfoliating Pads,192.49,4.52,True
Organic Eye Mask,104.39,3.97,True
Capture Youth Glow Supplyer Age-Delay Illuminating Serum,157.09,4.3281,True
Water-Infused Jelly Hyaluronic Serum,62.92,4.5878,True
Hydrating Firmr,85.59,4.4737,True
Intensive Moisture Clarifyr,85.95,2.42,False
Pro Strength Niacinamide Discoloration Treatment,45.0,4.37,True
Classic Face Chemical-Free Sunscreen Lotion Shield 30,27.69,4.43,True
Vitamin Supplyed Face Base Jumbo,74.79,4.92,True
Pitera First Experience Kit,28.34,3.85,False
The Essentials Sonic Dermaplaning Refill Kit,102.52,3.61,False
10% Waterless Ascorbic Serum,56.49,4.29,True
Shield+ Lip Repair Balm,56.33,4.71,True
Goopgenes Clean Replenishing Lip Balm Trio,63.83,3.97,True
Pro Lightening Spray Tan Kit,86.85,4.57,True
Even-Firm In A Wink Exfolikate Bestsellers Set,107.46,4.24,True
Mini Chemical-Freesing Wipes - Coconut Water,9.87,3.97,True
Rénergie Lift Multi-Action Night Cream,16.88,3.3,False
Dark Spots No More Triple Acid Spot Minimizing Concentrate,167.06,3.87,False
Vital Skin-Strengthening Hyaluronic Acid Super Serum,139.18,4.4,True
Dry Skin Saver,20.34,2.83,False
Even Skin Tone Self-Tanning Body Butter,75.52,4.24,True
Blue Algae L-Ascorbic Acid Skinclarity Radianceing Serum,58.26,4.5841,True
Extra-Firming & Smoothing Day Hydrationr With Spf 15,98.1,4.77,True
Wrinkle Release Facial Sheet Mask,93.71,3.39,False
Ascorbyl Tetraisopalmitate Solution 20% In Vitamin F,131.94,4.57,False
The Porefessional Smooth Sip Lightweight Gel-Cream Quenchr,136.16,4.14,True
Bye Bye Lines 1.5% Hyaluronic Acid Serum,102.83,4.4,True
Pineapple Enzyme Pore Clearing Detoxr,68.3,3.07,False
Mini Tetrahexyldecyl Ascorbate Glycolic Radianceing Serum,20.74,4.74,True
Shikulime Gel-To-Oil Revitalizer,13.33,3.6667,False
The Serum With  Tfc8,125.6,3.85,False
Sea Drink Of H2O Hydrating Nourishing Quenchr,62.44,4.41,True
V Shaping Facial Lift Depuff & Contour Serum With Hyaluronic Acid,93.11,4.4,True
Pore Perfecting Liquid Exfoliator With 2% Salicylic Acid + Borage,24.56,4.1768,True
Advanced A1 + Ferulic Overnight Texture Repairal Peel,25.73,4.5833,True
Fab Faves Trio,51.56,3.5,False
Banana Bright+ Ascorbic Eye Crème,58.75,4.26,True
Priming Moisturizer Rich Face Cream With Ceramide,63.49,4.41,True
Treatment Softener Rejuvenateed,22.48,4.19,True
Squalane + 10% L-Ascorbic Dark Spot Serum,64.88,4.26,True
Self-Tanning Oil Mist,177.29,3.77,False
Bye Bye Under Eye Glowing Eye Cream For Dark Circles,66.2,4.34,True
Purifying Chemical-Freesing Brush Head Refill,67.86,4.01,True
Wild Rose Night-Illuminateing Sleeping Facial,5.73,4.34,True
Mini Special Organicsing Gel,61.84,4.01,True
Luna Mini 3,159.09,3.5,False
Pineapple Enzyme Pore Clearing Purifyr,156.22,2.33,False
Self-Tanning Mitt,165.34,3.4,False
Urban Environment Vita-Clear Sunscreen Protect 42,39.94,4.27,True
Detoxing Lotion 1.0 Twice A Day Exfoliator,74.6,2.62,False
(Brighten)Setting 100% Mineral Powder Defend 35,59.24,4.7547,True
Clarifying Toner,9.91,4.19,True
Multivitamins 15% Vitamin C + Retinyl Acetate Mini Set,155.02,4.84,True
Clear Oil-Free Hydrater,157.57,4.36,True
Bha 2% Exfoliating Blemish Solution,7.03,4.49,True
Alpha Arbutin Shineing Serum,71.98,4.35,True
Lip Sleeping Mask,154.88,3.87,False
Hemp Mousse Mask - Anti-Blemish,129.7,3.76,False
Glycolic Foaming Purifyr,40.79,4.12,True
Alpha Beta Alpha Hydroxy Acid (Aha)/Salicylic Acid Daily Chemical-Freesing Gel,28.52,4.5461,True
The Silk Canvas Defendive Primer Mini,85.46,4.2643,True
Flatter Me Digestive Enzyme Supplement,51.04,3.27,False
Mini Defend+ Triple Lipid-Oligopolypeptides Face Cream,37.28,4.54,True
Mini Lapis Blue Tansy Face Oil - For Oily & Acne-Prone Skin,63.52,3.48,False
Hydrating Jasmine Mist - Royal Purify,32.2,4.13,True
Microneedling Anti-Aging Retinol Patches,43.41,4.65,True
The Daily Ascorbic Day Serum With Antioxidant Complex,73.64,4.2434,True
Renewing Bakuchi Crème - Eternal Reign,98.35,4.0481,True
Shine In A Wink Exfolikate Bestsellers Set,52.63,4.34,True
Creamy Eye Treatment With Avocado,104.9,3.87,False
Goodnight Glow Bakuchiol Sleeping Crème,60.49,4.3389,True
Sculpt + De-Puffing Rose Quartz Glopro Attachment Head,83.68,4.2155,True
Potent-C Tetrahexyldecyl Ascorbate Power Eye Cream,45.54,4.28,True
Natural Pro Obsidian,11.63,4.0,True
Shield+ Foaming Oil Hydrating Clarifyr,32.13,4.74,True
Max Mineral Tinted Sunscreen Broad Spectrum Blue Light Protection 45,44.33,4.28,True
Facial Treatment Purifyr,49.33,3.76,False
Sound Sleep Cocoon Night Gel-Cream,74.47,2.8824,False
Multi-Active Anti-Wrinkle Day Hydrationr With Anti-Pollution 20 For Luminousing Skin,132.13,4.85,True
Mineral Sunscreen Shield 30,88.45,4.28,True
Mini Vitamin Nectar Even-Tone Juice Antioxidant Face Serum,30.6,4.89,True
Super Anti-Aging Serum,193.99,4.2162,True
Plantscription Multi-Powered Refresh Polypeptides Serum,54.06,4.3,True
Mini 24-7 Moisture Hydrating Day & Night Cream,169.59,4.16,False
Regeneratewear Laser Focus Wrinkle Correcting Eye Cream,43.75,4.05,True
Reusable Cotton Pads,90.35,3.2381,False
That Overnight Hustle Alpha Hydroxy Acid (Aha) + Bha Resurfacer,26.66,4.46,True
Mini Sea Mermaid Skin Hyaluronic H2O Serum,40.04,4.4,True
Nubody Skin Toning Device,161.58,3.4,False
Hyaluronic Acid Acid Roller Dissolving Microneedling Tool,59.11,4.4,True
Clinical Discoloration Regenerate Serum,96.29,4.05,True
Mini Clean Moisturize Factors + Ha,6.5,4.36,True
Goopilluminate 15% Glycolic Acid Overnight Illuminate Exfoliate,184.68,4.53,True
De-Puffing Jade Facial Roller,90.59,3.62,False
Blending Brush,15.64,3.16,False
Hydration Detoxifying + Hydration Duo,145.87,4.16,True
Hydrating Skincare Gift Set,65.22,4.16,True
Pep-Start Eye Cream,61.72,3.83,False
Acne Control Purifying Cream Detoxr,137.94,2.95,False
Benefiance Wrinkle Smoothing Day Cream Protect 23,121.44,4.4545,True
Bestsellers Trial Kit,36.74,3.52,False
U.F.O. Bha Acid Bha Acne Treatment Face Oil,23.4,4.18,True
Acne Control 30-Day Trial Kit For Clearer Skin,96.99,3.16,False
Natural Hemp Mask,21.97,3.91,True
Sephora City Reusable Water Bottle,187.97,3.11,False
Oil-Absorbing Pore Treatment Strips,51.44,3.53,False
Advanced Retinyl Acetate + Ferulic Triple Correction Eye Serum,92.96,4.42,True
Benefiance Nutriperfect Night Cream,119.73,3.41,False
Super Fluid Daily Uv Defense Sunscreen Broad Spectrum Barrier 50+,26.96,4.28,True
Super Glow L-Ascorbic Glowing Face Serum,50.11,4.59,True
Self Tan Purity Water Gel,113.08,3.03,False
Equilibrium Restorative Hydrating Cream,54.13,4.65,False
Crème De La Mer Hydrater,28.17,4.16,True
Enzyme Cleansing Gel,34.45,3.91,True
Vitamin C Radiance Hydrationr,56.59,5.0,True
Mini Blueberry Bounce Gentle Detoxifyingr,74.07,3.77,False
Zincscreen 100% Mineral Sunscreen Lotion Barrier 40 Pa+++,70.6,4.27,True
Mini Must Haves Skincare Set,59.04,3.79,False
Glopro Eye Microtip Attachment Head,36.98,4.3532,False
Aqua Bomb Mist,130.25,3.81,False
Major Eye Impact Repair + Even-Tone Skincare Set,36.3,4.7,True
Gradual Self-Tanning Face Gel,23.75,3.75,False
Dr. Andrew Weil For Origins Mega-Bright Spf 30 Skin Tighten Correcting Oil-Free Hydrationr,97.33,4.68,True
Hydrating Firmr,130.38,4.48,True
Go Off Makeup Dissolving Mist,6.94,3.6,False
Superfruit Polish Tonic 8% Aha Solution,73.75,4.15,True
Rapid Radiance Set,41.49,4.35,True
The Essence Skincare Feeding Treatment – Lunar New Year Edition,67.79,3.51,False
Clearcalm Clarifying Clay Detoxifyingr,94.84,3.9213,False
Avocado Fine Line Eye Cream With All-Trans A1,64.59,4.43,True
10% Waterless Sodium Ascorbyl Phosphate Serum,43.26,4.27,True
Super Nova 5% Thd Magnesium Ascorbyl Phosphate + Caffeine Brightening Eye Cream,33.09,4.7526,True
The Nightly All-Trans Retinoate + Peptide Anti-Aging Serum,29.1,4.8085,True
Skin Filter Vitamin A And Zinc Blemish + Brightening Supplement,56.29,5.0,True
Glopro Face Microtip Attachment Head,82.25,4.35,False
Secret Solutions Pro-Glycolic 10% Resurfacing Toner,27.94,4.48,True
Uber Energy Adrenal Fatigue And Adaptogen Supplement,102.46,3.38,False
Complete Organicsing Microfoam,19.41,3.91,True
Retinoate Youth Restoreal Eye Serum,22.26,4.74,True
The Porefessional Get Unblocked Makeup-Removing Chemical-Freesing Oil,33.09,3.89,True
