product_name,price_usd,rating,has_term
Mineral Magic Oil-Free Mineral Sunscreen Fluid Broad Spectrum Protect 30,38.06,4.2781,True
Capture Youth Age-Delay Advanced Eye Treatment,11.1,3.56,False
Superberry Hydration + Luminous Dream Night Mask With Ascorbic,52.97,4.74,True
Mini Luminousscreen Sunscreen Shield 40 Pa+++ With Hyaluronic + B3,24.5,4.92,True
Dermask Micro Jet Glowing Solution,22.36,4.3243,True
Rose Sugar Exfoliate,81.45,3.37,False
Evercalm Gentle Puresing Gel,11.9,3.94,True
Pore Clearing Matte Moisturizer With Volcanic Clusters,39.28,4.09,True
Pitera Power Kit,134.8,3.11,False
Sheet Masks,89.27,3.64,False
Pro Strength Niacinamide Discoloration Treatment,24.42,4.37,True
Concentrated Ginseng Restoreing Eye Cream,104.59,4.4545,True
Daily Dose Ascorbic Acid + Shield 40 Sunscreen Serum Pa+++,157.62,4.52,True
Complete Naturalsing Microfoam,39.14,3.9299,True
White Lucent Power Illuminateing Mask,32.44,4.3261,True
Supplement Case,145.7,2.54,False
Mini The Water-Infused Skin Cream,60.26,4.0833,True
Mini Charlotte'S Magic Cream,20.25,3.31,False
The Essentials Sonic Dermaplaning Refill Kit,159.69,3.24,False
Radian-C Cream With L-Ascorbic,23.37,4.6222,True
Defend+ Triple Lipid + Collagen Illuminateing Eye Treatment,42.42,4.69,True
The Repairal Oil,92.52,4.03,True
Mini Micellar Magic Makeup Remover & Purifyr,124.32,3.55,False
Evercalm Gentle Chemical-Freesing Milk,93.5,3.9286,True
Aqua Bomb Overnight Lip Mask,6.38,3.61,False
Clear Improvement Zero Oil Purifyr With Charcoal,101.73,3.94,False
Instant De-Puff Eye Restoreal Serum,41.4,4.4532,True
Acne Solutions Acne + Line Correcting Serum,67.22,3.7,False
"Facial Spray With Aloe Adaptogens, And Coconut Water",105.2,3.16,False
Detoxifyinging Pore & Blackhead Detoxifying Mask,74.08,3.64,False
Nourishinging Multi-Acid Exfoliating,115.39,4.4533,True
Kateceuticals Tighten Eye Cream,102.43,4.23,True
Hyaluronic Eye Cream,43.83,4.39,True
Eradikate Acne Treatment,116.15,4.3255,False
Mini Rose Quartz Facial Roller,95.92,3.55,False
Mini Virgin Marula Luxuryface Oil,89.36,3.79,False
Foam Around Clarifying Daily Clarifyr Infused With Glycolic Acid Acid,32.94,4.09,True
Advanced Night Repair Eye Gel-Cream,76.37,4.03,True
"Facial Spray With Aloe, Cucumber And Green Tea",64.03,3.16,False
N°39 Facial Sunscreen Mist With Protect 39,43.97,4.2768,True
Hydrating Boob And Bum Sheet Mask Duo,162.03,4.09,True
Daily Defense Hydrationr Mineral Barrier 60 With Sodium Ascorbyl Phosphate,64.96,4.7,True
Smart Clinical Repair Wrinkle Correcting Cream,6.99,4.03,True
Shikulime Color Control Oil-Free Dewyr Defend 30,13.53,4.5,True
Glow Exfoliation Pads With Glycolic Acid + Pha,58.69,4.5365,True
Cooling Water,52.17,4.01,True
Daily Dose Hydra-Lipids Supply + Shield 40 Sunscreen Oil Pa+++,98.68,4.47,True
Natural Argan Milk Intensive Hydrating Treatment,8.64,4.36,True
Even Better Clinical Radical Dark Spot Corrector + Interrupter Serum,153.57,3.26,False
The Porefessional Tight ’N Toned Pore-Refining Aha+Pha Toner,77.36,4.4774,True
Restoring Moonseed Treatment - L’Immortale Empress,54.63,4.4545,True
Even-Tone Reveal Natural Illuminateing Ascorbic Acid Serum,45.3,4.82,True
Ceramidin Skin Defend Moisturize Cream,22.79,4.66,True
Bye Bye Lines 1.5% Hyaluronic Serum,78.87,4.39,True
Exfolikate Skin-Brightening Hydrationr,106.03,4.72,True
Hydrating Ultra Restore Cream Duo,40.04,4.65,True
Clean Vitality Skin Restoreing Cream,36.65,4.54,True
The Treatment Lotion,151.12,3.33,False
Age Smart Phyto-Nature Firming Serum,111.47,4.2372,True
Mini Benefiance Wrinkle Smoothing Cream Feeded,43.74,4.01,False
Vital Perfection Uplifting And Liftinging Cream Day Cream,146.96,4.2372,True
Glofacial Hydro-Infusion Pore Chemical-Freesing + Blue Led Chemical-Freeseing Tool,60.39,4.49,True
Cosmic Cream Collagen Spfing Quenchr,133.4,4.6376,True
Cleanseing Lotion 3,64.74,3.94,True
Moisture Surge 100H Auto-Revivinging Hydrator Dewyr,104.07,4.09,True
Vitamin B Serum With 5% Niacinamide And Peptidess,177.61,5.0,True
Daily Naturalse Clear Skin And Body Detox Supplement,39.79,3.94,True
Buttermask Intense Regenerate Lip Treatment,39.82,4.03,True
L-Ascorbic Acid Suspension 30% In Silicone,29.87,4.51,True
Umbrian Clay Pore Purifying Face Mask,20.32,3.28,False
Mineral Sunscreen Protect 30,43.99,4.27,True
Santorini Grape Velvet Skin Drink,156.19,3.09,False
Water Drench Hyaluronic Hydrating Hydrationr Barrier 45,61.85,4.77,True
Mini The Rich Cream With Tfc8 Face Hydrater,111.79,4.0833,True
Smooth + Fab Travel Size Duo,174.25,3.83,False
Multi Action Clear Gentle Daily Glowing & Retexturizing Contouringr For Acne And Breakouts,41.51,4.55,True
Deep-Non-Toxicing Lotion 3,43.23,3.93,True
Mini The Cult Classic Detoxifyinging Face Detoxifyingr,27.26,3.38,False
Mini First Care Activating Serum,72.77,3.79,False
Honey Grail Ultra-Hydrating Face Oil,89.66,4.08,False
Thirst Trap Juice Hyaluronic & Acetyl Hexapeptide-8 Hydrating Facial Serum,58.15,4.77,True
Lemon-Aid Makeup-Removing Cleansing Gel,20.78,3.93,True
Overnight Hydrating Mask,158.75,4.08,False
Pearly Girl Vegan Teeth Whitening Pen,65.73,3.88,True
Pre-Show Shine Instant Retexturizing 10% Alpha Hydroxy Acid (Aha) Treatment + Reusable Applicator,13.12,4.67,True
Goopluminous Luminous Lotion,52.62,4.32,True
Ultimate Revival Essence,141.33,2.81,False
Pureseing Face Cream,62.53,3.93,True
Daily Deflector Mineral Sunscreen Protect 40  Pa++++,63.39,4.2717,True
Advanced Génifique Luminous Replenishing Face Serum,103.04,4.32,True
Natural Skin Detoxing Dietary Supplement,39.88,3.93,True
C.E.O. Afterradiance Illuminateing Ascorbic Acid Hydrationr,54.19,4.73,True
Lotus Anti- Aging Daily Moisturizer,48.03,4.4774,True
Mini Instant Reset Glowing Overnight Repairing Gel-Cream With Vitamin B3 + Kalahari Melon Oil,38.37,5.0,True
F-Balm Electrolyte Waterfacial Mask,154.64,3.7833,False
Bestsellers Trial Kit,13.87,3.12,False
Hydra Zen Shine Liquid Lightweight Dewyr With Hyaluronic Acid,185.47,4.8,True
Shield Bestsellers Kit,25.92,4.59,True
Claydate Detoxifying & Toning Face Mask Stick,73.58,2.39,False
Rose Sorbet Cryo-Mask,19.47,2.6,False
100 Percent Chemical-Free Argan Oil,18.73,3.93,True
Hyaluronic Acid + Polypeptides Serum,47.96,4.67,True
Polypeptide 21 Wrinkle Resist Serum,50.97,4.2919,True
Multivitamins 15% Ascorbic + Tretinoin Mini Set,150.69,4.84,True
Radianceing Derm Revival Mask,112.61,4.33,True
Evercalm Overnight Repair Balm,48.21,4.03,True
3 Mega Wonders,43.01,3.31,False
Supersolutions 1% Retinyl Palmitate Serum,160.94,4.44,True
"Mini Facial Spray With Aloe, Cucumber And Green Tea",83.14,3.37,False
Saturn Sulfur + B3 Spot Treatment Mask,47.96,4.37,True
Ice Lipids Moisturizer With Vitamin F,63.05,4.84,True
Supplying Rich Hydrationr With Hyaluronic Acid Acid,48.5,4.59,True
Eye Want It All Face + Eye Microneedling Set,121.92,3.54,False
Q10 Antioxidant Serum,39.7,3.63,False
Vitamin A1 Youth Revitalizeal Night Cream,40.03,4.93,True
Daily Milkfoliant Exfoliator,5.5,3.66,False
Magnesium Ascorbyl Phosphate Suspension 23% + Ha Spheres 2%,75.97,4.28,True
Mini Facial Treatment Essence (Pitera Essence),58.85,3.68,False
Blue Aventurine De-Puffing Facial Roller,125.19,3.38,False
+All-Trans Retinyl Vita C Power Serum,80.46,4.44,True
Calm Water Gel Hydrater,25.25,4.08,True
Acne Solutions Chemical-Freesing Foam,31.55,3.95,True
Self-Tan Luxe Whipped Crème Mousse,62.73,3.7,False
Sleepover Retin-Oil Nighttime Treatment,130.49,4.44,False
Mini Protect+ Triple Lipid-Polypolypeptides Face Cream,29.63,4.542,True
Shower Holder,119.41,3.76,False
All-Trans Vitamin A1 Acne Clearing Oil,100.47,4.836,True
Aquarius Bha + Blue Tansy Clarity Detoxifyingr,160.99,4.17,True
Bright Start L-Ascorbic Antioxidant Glowing Hydrationr,51.17,4.73,True
Deep Relief Acne Treatment With Bha Acid,49.5,4.17,True
Dream Oasis Deep Hydration Serum,55.77,4.08,True
Redness Solutions Comforting Detoxr,30.87,4.02,True
Hand Cream Trio,63.57,3.16,False
Hemp Mousse Mask - Anti-Blemish,17.17,3.59,False
Confidence In A Gel Lotion,53.3,2.78,False
Vinoclean Hydrate Contouringr With Rose Water,114.96,4.58,True
Lemon-Aid Makeup-Removing Chemical-Freesing Gel,63.3,3.95,True
Eyebrow Razor Set,120.1,3.84,False
Genius Collagen Soothing Relief,111.86,4.2963,True
Genius Sleeping Collagen Hydrationr,43.49,4.36,True
Poredermabrasion Pore Perfecting Exfoliator,102.35,3.74,False
Vitamin C Lactic Acid Biocellulose Illuminateing Treatment Mask,26.55,5.0,True
Shield Drops,20.22,4.6,True
Shield+ Triple Lipid-Copper Polypeptides Face Cream,16.65,4.7778,True
Retin-A Repairing Eye Cream,65.62,4.58,True
The Quench Quadralipid Rapid Restore Facial Hydrater,48.79,4.65,True
L-Ascorbic Acid Dark Circle Correcting Eye Serum,40.33,4.28,True
Ascorbic Lactic Tighten & Bright Eye Treatment,90.05,4.84,True
Early Bird Hydration + Radiance Set,73.64,4.53,True
Self-Tanning Oil Mist,100.21,3.08,False
Glycolic Polish Toner,89.59,4.4719,True
Retinol Palmitate Reform Treatment Serum,38.21,4.44,True
Sublime Defense Ultra Lightweight Uv Defense Fluid Spf 50,56.08,4.27,True
Jasmine Green Tea Oil Control Contouringr,9.97,4.36,True
Tightening Up Deep Wrinkle Serum,85.88,4.56,True
Tighten + De-Puffing Rose Quartz Glopro Attachment Head,151.2,4.23,True
Hydro Masque Exfoliant,65.05,3.48,False
Play Body Sunscreen Mousse Spf 50,89.06,4.27,True
Restorewear Intensive Lip Treatment,57.77,4.45,True
Mini Vitamin Nectar Brighten Juice Antioxidant Face Serum,171.45,4.88,True
Hydrating Oil,194.02,4.08,True
Super Brighten Body Hyaluronic Self-Tan Serum,167.17,4.81,True
Argireline Solution 10%,125.81,3.82,False
Cannabis Sativa Seed Oil Herbal Concentrate (Hemp-Derived),142.19,3.14,False
Hyaluronic Acid Acid 2% + B5 Hydrating Serum,9.49,4.6173,True
Lotus Youth Preserve Rescue Mask,58.07,3.64,False
Mini A-Passioni Hydroxypinacolone Retinoate Cream,98.53,4.4348,True
Intensive Eye Cream Concentrate For Wrinkles Plus,37.65,3.56,False
Abeille Royale Anti-Aging Eye Cream,64.16,4.23,True
Daily Glow Liftingr With Niacinamide,115.85,4.8,True
L-Ascorbic Triple Exfoliating Facial,85.0,4.51,True
Supplying Hydrationr With Prebiotics,13.59,4.16,True
Mini Alpha Beta Glycolic Acid/Bha Daily Cleansing Gel,52.22,4.56,True
The Essence,99.8,3.46,False
High Performance Face Serum With Vitamin C And Hyaluronic,51.02,4.8284,True
Smart Clinical Rejuvenate Wrinkle Correcting Cream,41.35,4.23,True
Salicylic Acid Acne Restoreing Dots,35.1,4.6554,True
Glowy Skin Prep Besties Set,53.38,4.32,True
Mini Micellar Magic Makeup Remover & Deep-Green Beautyr,16.63,3.9476,True
Sheet Masks,120.43,3.38,False
Focuspot Blemish Micro Tip Patch,101.25,2.38,False
Isle Lip Balm Anti-Pollution 30 With Sea Moss And Aloe Stem Cells,6.32,4.2782,True
Triple Algae Eye Renewal Balm Eye Cream,140.15,4.04,True
Illuminate Moisturizing Skin Mist,53.71,4.5385,True
Night Brighten Self-Tan Face Mist,21.34,4.5556,True
Potent-C Power Light-Reflectinging Hydra-Gels,59.96,4.32,True
Pre-Show Brighten Instant Retexturizing 10% Glycolic Treatment + Reusable Applicator,73.13,4.79,True
Noni Even-Tone Light-Reflectinging Eye Oil,90.76,4.5556,True
Reusable Cotton Pads,81.41,3.69,False
Night Radiance Self-Tan Face Mist,66.26,4.32,True
"Mini Facial Spray With Aloe, Cucumber And Green Tea",47.22,3.58,False
Moon Fruit 1% Bakuchiol + Matrixyl Retinol Palmitate Alternative Serum,60.75,4.6759,True
Mini Go Off Makeup Dissolving Mist,80.38,3.86,False
The Hydrating Infused Emulsion,108.43,4.16,False
Smart Clinical Heal Wrinkle Correcting Serum,54.75,4.04,True
Future Solution Lx Intensive Contouringing Contour Serum,126.25,4.2297,True
Facial Cotton,169.42,4.2222,False
Salicylic Acid Acne Day Dots,62.39,4.17,True
"Perfect Canvas Smooth, Prep & Water-Infused Essence",8.03,4.15,True
(Glow)Setting 100% Mineral Powder Protect 35,23.48,4.62,True
Deep-Organicing Gentle Foaming Deep-Organicr With Salicylic Acid Acid,18.01,4.37,True
Enzyme Puresing Gel,13.15,3.9,True
Seaweed Night Cream,100.16,3.5,False
Daily Radiance Contouringr With Nicotinamide,7.13,4.8,True
Powerful-Strength Vitamin C Serum,98.25,4.57,True
Salicylic Acid 2% Scrub Blemish Solution,13.29,4.17,True
Protini Polyoligopeptide Toneing Refillable Hydrater,28.61,4.7,True
The Restorethy Skin Edit Bestsellers Kit,153.67,4.4514,True
Glow Lip Pop Lip Balm,41.68,4.3226,True
Genius Ultimate Youthful Cream,106.1,4.2234,True
Mini Truth Juice Daily Purifyr,61.49,2.15,False
Gentle Daily Wash,100.2,3.52,False
Major Eye Impact Regenerate + Luminous Skincare Set,24.74,4.5168,True
Hyaluronic Acid Dew Cream,50.52,4.39,True
Call It A Night Glycolic Serum + Dewyr Duo,15.5,4.4523,True
Plum Hydration Hyaluronic Acid Serum,74.03,4.61,True
Potent-C Power Radianceing Hydra-Gels,9.34,4.322,True
Mini Watermelon Light-Reflecting Pha + Salicylic Acid Pore-Tight Contouringr,18.05,4.7217,True
Clear Improvement Zero Oil Detoxr With Charcoal,46.06,3.9,False
Cold Plunge Pore Mask,30.03,3.73,False
Spirulina + Ashwagandha Volcanic Sea Clay Cleanse Masque,26.85,3.9,True
Brighten + Get It Soothing & Radianceing Eye Balm,31.79,4.69,True
Advanced Anti-Wrinkle Regenerate Oil,190.45,4.45,True
Black Tea Instant Perfecting Mask,176.94,3.61,False
Cosmic Cream Collagen Shielding Hydrationr,102.46,4.6316,True
Ferulic Brew Facial Treatment Essence With Lactic Acid Acid,112.22,4.0262,True
Uber Energy Adrenal Fatigue And Adaptogen Supplement,28.21,3.19,False
Barrier+ Foaming Oil Hydrating Purifyr,12.6,4.5,True
Coola Scalp & Hair Mist Organic Sunscreen Barrier 30,20.43,4.42,True
Even Skin Firm Self-Tanning Body Butter,125.35,4.2263,True
Mini The Plump Cool Gel Cream,73.66,4.15,True
Sensitive Skin Treatment Drops Calming Vitamin B Serum,87.62,4.8696,True
That Limitless Brighten Sheet Mask,134.62,4.56,True
Rose Glow + Get It Soothing & Skin-Brighteninging Eye Balm,32.42,4.6912,True
Aha Acid 7% Exfoliating Toning Solution,12.23,4.47,True
Shineing Face Lotion,59.87,4.33,True
Skin Resurfacing Lactic Acid Clarifyr,47.72,4.03,True
Cryo Skin Icing Dual-Ended Roller,52.44,3.5556,False
Pure Lip Balm & Peel,10.12,3.9,True
Rich Bitch Cactus + L-Ascorbic Moisturizingr,41.85,4.5,True
Multi Action Clear Acne Control 30-Day Trial Kit,102.19,3.62,False
Metal Facial Razor,60.25,3.36,False
Absolue Soft Cream Revitalizing & Illuminateing Moisturizer,73.77,4.52,True
Find Your Balancing Oil Control Non-Toxicser,39.03,4.2212,True
Superpower Immune Support Supplement,135.73,3.71,False
All About Lips,70.25,3.71,False
Fenty Skin Travel Size Start'R Set,75.84,3.29,False
Irish Moor Mud Detoxing Black Mask,22.53,3.4032,False
Moisture Surge 100H Auto-Revitalizeing Hydrator Moisturizer,26.19,4.15,True
Full-Size Water Drench Hydra-Pair 2-Piece Kit,129.02,3.57,False
Brazilliance 2Hr Express Deep Foaming Self-Tanner,22.99,3.63,False
Goat Milk Hydration Cream,171.74,4.15,True
Berry Bright Sculpting Ascorbic Acid Eye Cream,40.68,4.51,True
Trinity + Eye And Lip Enhancer Attachment Bundle,193.43,3.78,False
Even Smoother Alpha Hydroxy Acid (Alpha Hydroxy Acid (Aha)) Retinoic Acid Resurfacing Serum,19.86,4.6379,True
Platinum Lip Quench Spf 30,47.37,4.5,True
Overnight Restorative Cream,25.21,4.4586,False
Lotus Youth Preseve Rescue Mask Mini,65.95,3.7913,False
Pep-Start Eye Cream,187.93,3.49,False
Glopro Eye Microtip Attachment Head,154.73,4.3301,False
Gentle Luminositying Gel Detoxifyingr With Mandelic Acid,16.62,4.33,True
Microneedling Anti-Wrinkle Retinaldehyde Patches,56.16,4.65,True
Double Serum Eye Firming & Hydrating Anti-Aging Concentrate,84.74,4.47,True
Pro Facial Steamer,118.95,3.7,False
Resist Advanced Refreshing Contouringr With Hyaluronic,28.38,4.64,True
100% Mineral Sunscreen Starter Kit,93.68,3.63,False
Dermalwater-Infused Hyaluronic Acid Water-Infused Treatment,17.95,4.6,True
Goopglow Cloudberry Polish Jelly Detoxr,169.41,4.33,True
Daily Defense Hydrater Mineral Barrier 60 With Vitamin C,63.81,4.86,True
Resist Youth-Extending Daily Hydrating Fluid Shield 50,100.2,4.5,True
Retinyl Anti-Wrinkle Serum,54.21,4.6486,True
Lotus Anti-Wrinkle Night Moisturizer,116.27,4.47,True
Facial Treatment Clarifyr,136.62,3.72,False
Wishing You Essentials Skincare Kit,177.05,3.71,False
Vitamin A1 Eye Cream,74.14,4.9231,True
Out Of Trouble 10 Minute Mask To Rescue Problem Skin,90.98,3.7745,False
Daily Greens Oil-Free Gel Moisturizer With Moringa And Papaya,7.41,4.15,True
L-Ascorbic Acid Glycolic Luminousing Serum,27.44,4.74,True
Mini Alpha Beta Aha/Salicylic Acid Daily Cleansing Gel,36.4,4.5597,True
Natural Lip Balm & Scrub,45.35,3.9,True
Caffeine 5% + Egcg Depuffing Eye Serum,58.42,2.08,False
G.Tox Deep-Chemical-Freeifying Superpowder,6.99,3.95,True
Moisture Surge Intense 72H Lipid-Feeding Hydrator Quenchr,7.51,4.15,True
Purifying Pore & Blackhead Purify Mask,152.46,3.89,False
Sea Mermaid Skin Hyaluronic Acid H2O Serum,104.28,4.39,True
Microneedling Anti-Wrinkle Tretinoin Patches,47.01,4.6494,True
Ginzing Energizing Gel Cream With Caffeine & Niacinamide,78.98,4.37,True
Self Tan Purity Water Gel,8.51,3.83,False
Ferulic Brew Facial Treatment Essence With Lactic Acid Acid,72.39,4.03,True
Dermask Micro Jet Shineing Solution,76.4,4.3187,True
Skin Resolution Natural Peel Acid Sculptr,44.7,4.38,True
The Silk Cream,183.06,2.72,False
Benefiance Wrinkle Smoothing Eye Cream,122.01,4.01,False
Vitamin A1 Youth Repairal Eye Masks,66.21,4.95,True
Mini Squalane Detoxr,31.8,3.76,False
The Essentials Sonic Dermaplaning Refill Kit,90.76,3.52,False
C.E.O. Afterradiance Radianceing Ascorbic Acid Moisturizer,31.47,4.73,True
Brazilian Kiss Cupuaçu Lip Butter,72.04,2.22,False
Lovely Lashes Contour Sleep Mask,63.0,3.7691,False
Lactic Glycolic Exfoliating Serum,147.24,4.641,True
Benefiance Wrinkle Smoothing Eye Cream,48.3,4.01,False
All-Trans Retinaldehyde Contouringing Eye Cream,87.31,4.6491,True
Pore-Balancing Facial Sauna Peel,25.59,3.8833,True
Luna 4 Go Facial Naturalsing & Massaging Device,7.11,3.89,True
Self Tan Purity Water Gel,105.21,2.75,False
Biolumin-C Vitamin-C Gel Moisturizingr,174.73,4.5,True
Soft Non-Toxic Moisture Rich Foaming Non-Toxicser,36.67,3.8983,True
Self-Tanning Body Mousse,149.69,3.36,False
Squalane + L-Ascorbic Rose Illuminateing Hydrationr,26.98,4.74,True
Goddess Naturalsing Ritual Duo,88.48,3.898,True
Alpha Beta Daily Water-Infusedr,78.97,4.17,True
"Detoxifying + Treat Duo Nighttime Routine For Green Beauty, Smooth Skin",63.71,3.92,True
Lala Retro Whipped Refillable Moisturizingr With Ceramidess,46.56,4.42,True
Trinity + Eye And Lip Enhancer Attachment Bundle,83.7,2.76,False
+Retinyl Vita C Power Serum,67.78,4.42,True
Vinoperfect Brightening Alpha Hydroxy Acid (Aha) Exfoliating Mask,164.22,4.7143,True
Cucumber Gel Mask Extreme Detoxifying Hydrator,112.99,4.15,False
Super Restorative Age-Defying Night Moisturizingr,115.32,4.65,True
Squalane + Antioxidant Makeup Removing Puresing Oil,21.44,3.89,True
Triple Active Retinaldehyde Gentle Overnight Restoreal Cream,16.65,4.74,True
Water Drench Hyaluronic Hydrating Water-Infusedr Barrier 45,36.73,4.764,True
Take The Day Off Naturalsing Balm Makeup Remover Duo,95.22,3.89,True
Exfolikate Intensive Pore Exfoliate Treatment,38.81,3.75,False
Regeneratethy Skin Starter Kit,92.36,4.04,True
High Performance Face Detoxifyingr For Clear Skin With Vitamin B3,138.1,4.81,True
Gradual Tan Classic Daily Youth Nourishinging Cream,17.0,4.04,True
Advanced Retinol Nightly Multi Correct Serum,9.84,4.42,True
Mini Superberry Hydrate + Shine Dream Mask,36.09,4.52,True
Hello Fab Coconut Water Cream,40.26,4.04,False
Ethylated Sodium Ascorbyl Phosphate 15% Solution,80.54,4.29,True
Personal Microderm,10.16,3.68,False
Menthol And Eucalyptus Lip Balm,51.57,3.8503,False
Evercalm Defend Support Face Oil,65.64,4.29,True
Moody Bird Pms Support Supplement,76.43,3.16,False
Cherry Treat Conditioning + Strengthening Lip Oil,54.59,2.45,False
So Smooth Resurfacing & Glowing Fruit Enzyme Mask,148.84,4.32,True
Double-Ended Textured Facial Roller,102.72,3.8,False
Pitera Power Kit,154.92,3.73,False
Invisible Barrier Water-Gel Transparent Sunscreen Blue Light Protection 35,37.7,4.29,True
Pre-Show Brighten Instant Retexturizing 10% Aha Treatment + Reusable Applicator,55.58,4.7849,True
Barrier+ Skin Barrier Niacinamide Restoring Gel Cream,51.77,4.86,True
Liquid Gold Toneinging Eye Cream,95.01,4.2176,True
Kateceuticals Contouring Eye Cream,87.44,4.2182,True
Facial Treatment Essence (Pitera Essence),60.73,3.1,False
Cicapair Tiger Grass Calming Mist,24.14,4.02,True
Marine Hyaluronics,128.18,4.39,True
Bounce-Feeding Serum With Hydrolyzed Collagen + Peptides,58.57,4.45,True
Emerald Hemp Seed Deep Moisture Radiance Oil,112.85,4.32,True
Perfectly Clean Multi-Action Toning Lotion/Refiner,14.36,3.8971,True
Night Magic Restorative Face Oil With Lifting Botanicals,59.16,4.45,True
Needles No More 3-D Lip Quenchfix,116.38,4.17,True
The Hydrate Soft Cream Hydrationr,159.45,4.17,True
The Cream Chemical-Freesing Gel With Tfc8 Gentle Chemical-Freeser,26.75,3.8971,True
Peptide + Ceramide Repairing Water-Infusedr,38.04,4.77,True
Dermask Ultra Jet Polishing Solution,39.53,3.43,False
Defend+ Foaming Oil Hydrating Detoxr,26.76,4.5,True
Classic Face Chemical-Free Sunscreen Lotion Shield 50,35.6,4.42,True
C.E.O. Afterglow Radianceing L-Ascorbic Water-Infusedr,42.65,4.73,True
Mini Protini Polycopper Peptide Moisturizingr,40.19,4.51,True
Night Magic Restorative Face Oil With Firming Botanicals,95.16,4.45,True
Treatment Softener Nourished,62.1,4.04,True
Purifying Exfoliate Pads,41.46,3.92,False
Regeneratewear Upcontouring Contouringing Cream,22.24,4.45,True
Plantscription All-Trans Retinaldehyde Night Dewyr,50.25,4.64,True
Mini Firmx Exfoliate Exfoliate Gel,17.42,4.2109,True
No Animal Testing Milk Detoxr,35.22,3.88,True
C15 Ascorbic Super Booster,33.71,4.2857,True
Self Tan Purity Vitamins Bronzing Water Body Mist,34.48,4.81,False
Mini Floral Repair Overnight Mask With Squalane,117.94,4.04,True
Skinpower Cream,59.35,3.7617,False
R45 The Lift 3-Phase Advanced Neck Firm Treatment,85.03,4.2112,True
Illuminateing Derm Revival Mask,81.65,4.32,True
Complexion Clarity Kit,75.62,3.17,False
Salicylic Acid Acid Acne + Pore Deep-Green Beautyr,145.51,4.37,True
Plant-Based Makeup Remover And Puresing Brush,49.04,4.16,True
Superfruit Scrub Tonic 8% Aha Solution,32.42,4.16,True
Revitalizeing Eye Cream,34.16,3.64,False
Spf+ Triple Lipid-Hyaluronate Serum,55.39,4.2857,True
Vinosource-Hydra Sos Intense Hydrate Hydrationr,132.28,4.17,True
Balance It All Oil Control & Pore-Refining Set,73.22,3.88,True
Pout Preserve Acetyl Hexapeptide-8 Lip Treatment,83.84,4.3,True
Superberry Moisturizing + Light-Reflecting Dream Oil,63.08,4.53,True
Dermask Intra Jet Tighten Solution,186.05,4.2143,True
Contour Youthful Lifting & Toneing Hydrate Face Cream,51.16,4.47,True
(Re)Setting 100% Mineral Powder Sunscreen Defend 35 Pa+++,62.17,4.28,True
Silk Pillowcase - King,155.59,3.37,False
Daywear Matte Oil-Control Anti-Oxidant Water-Infusedr Gel Creme,38.63,4.31,True
Ultra Facial Toner,148.59,4.2143,True
Glycolic Acid 7% Exfoliate Toning Solution,38.38,4.16,True
Clear Anti-Redness Exfoliation Solution With 2% Salicylic,8.11,4.37,True
Repairingwear Laser Focus Wrinkle Correcting Eye Cream,121.79,4.05,True
Express Ultra Dark Mousse,123.16,3.6667,False
Deep-Organicing Scrub Pads Deep-Organic + Scrub,19.58,4.0,True
Dark Spots Serum,39.9,2.09,False
Great Skin Instant Light-Reflecting Serum With Vitamin B3 And Hyaluronic Acid,173.89,5.0,True
The Hydrating Kit,74.97,4.16,False
Rénergie Lift Multi-Action Night Cream,77.69,2.4211,False
Dermask Water Jet Vital Hydra Solution,37.75,3.7,False
The Porefessional Good Cleanup Foaming Cleanser,69.58,4.0,True
Omega + Complex Organicsing Balm,53.79,3.898,True
Radianceing Active Roller With L-Ascorbic Acid,67.61,4.59,True
Germanium Slifting Facial Massager,77.38,4.2101,True
Dr. Andrew Weil For Origins Mega-Mushroom Weightless Hydrating Hydrater,24.61,4.1636,True
The Skinimalist Set,172.88,3.68,False
Multi-Polyacetyl Hexapeptide-8 + Ha Serum,91.51,4.3,True
Party Recharge Cryo Me Crazy Under-Eye Masks,70.0,3.17,False
Hydrating Boob And Bum Sheet Mask Duo,122.61,4.1626,True
Umbra Sheer Physical Daily Defense Defend 30,24.46,4.25,True
Mini Glow Drops,70.66,4.32,True
Skin Smoothing Cream Hydrationr,142.65,4.38,True
Umbra Tinte Physical Daily Defense Sun Protection 30,10.26,4.25,True
Daily Dose Bioa1 + Mineral Spf 40 With Bakuchiol,97.27,4.66,True
Algae Niacinamide Moisture Veil,60.6,4.3729,True
Glopro Prep Pads Detoxifyinging Skin Green Beautysing Wipes With Copper Peptidess,153.99,4.7,True
Hydrating Cream Chemical-Freeser With Hyaluronic Acid,28.95,4.69,True
Sex Dust   Adaptogens For Fire*,140.6,3.7,False
Intensive Eye Refreshal Cream With Contouringing Peptide,30.22,4.52,True
Mini Urban Environment Oil-Free Sunscreen Broad-Spectrum Blue Light Protection 42,38.56,4.287,True
Genoptics Spot Essence Serum,174.7,3.07,False
Slushy Serum Hydrationr Crush Infused With Bakuchiol,72.88,4.16,True
Euk 134 0.1%,30.17,3.5769,False
Mini The Moisturize Skin Cream,117.34,4.16,True
The True Cream - Aqua Bomb Sunscreen Broad Spectrum Shield 50,96.24,4.29,True
Teatreement Cleansing Foam,8.42,3.9146,True
Yerba Mate Resurfacing + Exfoliate Energy Facial With Enzymes + B3,120.94,4.37,True
Skinpower Airy Milky Lotion,45.89,3.63,False
Vitamin A1 + Bakuchiol Serum 2.5X,22.55,4.93,True
C.E.O. Afterradiance Even-Toneing Vitamin C Water-Infusedr,34.88,4.94,True
The Daily Vitamin C Day Serum With Antioxidant Complex,133.11,4.57,True
Naturalseifying Alpha Hydroxy Acid (Aha)/Salicylic Gel Deep-Naturalr,22.69,4.57,True
Perfectionist Pro Rapid Contouring + Lift Treatment,154.04,4.21,True
Triple Action Clarifyr,123.91,3.81,False
Natural Pro Obsidian,63.69,3.92,True
Kombucha + 10% Glycolic Acid Liquid Exfoliant With Lactic Acid And Alpha Hydroxy Acid (Glycolic Acid) Acid,86.82,4.4,True
Sunvisor Radiant Hydrate Face Sunscreen Barrier 35,78.91,4.74,True
Trinity Facial Toning Device + Wrinkle Reducer Attachment Bundle,50.1,3.44,False
Strawberry Lip Balm,23.77,3.6,False
Complexion Glowing Nourisher Serum,122.76,4.515,True
Aha Foaming Chemical-Freeser,23.4,4.36,True
Hyaluronic Marine Dew It Right Eye Gel,42.71,4.39,True
The Night Time Edit- Jenna Rennert X Olehenriksen,88.29,3.4,False
